[ALERT] SYN Packet detected from 10.0.0.95 to 192.168.1.1 at 2024-11-25 21:41:44
Packet Data: Ether / IP / TCP 10.0.0.95:12345 > 192.168.1.1:http S
[ALERT] SYN Packet detected from 10.0.0.95 to 192.168.1.1 at 2024-11-25 21:41:44
Packet Data: Ether / IP / TCP 10.0.0.95:12346 > 192.168.1.1:http S
[ALERT] SYN Packet detected from 10.0.0.95 to 192.168.1.1 at 2024-11-25 21:41:44
Packet Data: Ether / IP / TCP 10.0.0.95:12347 > 192.168.1.1:http S
[ALERT] SYN Packet detected from 10.0.0.95 to 192.168.1.1 at 2024-11-25 21:41:44
Packet Data: Ether / IP / TCP 10.0.0.95:12348 > 192.168.1.1:http S
[ALERT] SYN Packet detected from 10.0.0.95 to 192.168.1.1 at 2024-11-25 21:41:44
Packet Data: Ether / IP / TCP 10.0.0.95:12349 > 192.168.1.1:http S
[ALERT] SYN Packet detected from 10.0.0.95 to 192.168.1.1 at 2024-11-25 21:41:44
Packet Data: Ether / IP / TCP 10.0.0.95:12350 > 192.168.1.1:http S
[ALERT] SYN Packet detected from 10.0.0.95 to 192.168.1.1 at 2024-11-25 21:41:44
Packet Data: Ether / IP / TCP 10.0.0.95:12351 > 192.168.1.1:http S
[ALERT] SYN Packet detected from 10.0.0.95 to 192.168.1.1 at 2024-11-25 21:41:44
Packet Data: Ether / IP / TCP 10.0.0.95:12352 > 192.168.1.1:http S
[ALERT] SYN Packet detected from 10.0.0.95 to 192.168.1.1 at 2024-11-25 21:41:44
Packet Data: Ether / IP / TCP 10.0.0.95:12353 > 192.168.1.1:http S
[ALERT] SYN Packet detected from 10.0.0.95 to 192.168.1.1 at 2024-11-25 21:41:44
Packet Data: Ether / IP / TCP 10.0.0.95:12354 > 192.168.1.1:http S
[ALERT] SYN Packet detected from 10.0.0.95 to 192.168.1.1 at 2024-11-25 21:41:44
Packet Data: Ether / IP / TCP 10.0.0.95:12355 > 192.168.1.1:http S
[ALERT] SYN Packet detected from 10.0.0.95 to 192.168.1.1 at 2024-11-25 21:41:44
Packet Data: Ether / IP / TCP 10.0.0.95:12356 > 192.168.1.1:http S
[ALERT] SYN Packet detected from 10.0.0.95 to 192.168.1.1 at 2024-11-25 21:41:45
Packet Data: Ether / IP / TCP 10.0.0.95:12357 > 192.168.1.1:http S
[ALERT] SYN Packet detected from 10.0.0.95 to 192.168.1.1 at 2024-11-25 21:41:45
Packet Data: Ether / IP / TCP 10.0.0.95:12358 > 192.168.1.1:http S
[ALERT] SYN Packet detected from 10.0.0.95 to 192.168.1.1 at 2024-11-25 21:41:45
Packet Data: Ether / IP / TCP 10.0.0.95:12359 > 192.168.1.1:http S
[ALERT] SYN Packet detected from 10.0.0.95 to 192.168.1.1 at 2024-11-25 21:41:45
Packet Data: Ether / IP / TCP 10.0.0.95:12360 > 192.168.1.1:http S
[ALERT] SYN Packet detected from 10.0.0.95 to 192.168.1.1 at 2024-11-25 21:41:45
Packet Data: Ether / IP / TCP 10.0.0.95:12361 > 192.168.1.1:http S
[ALERT] SYN Packet detected from 10.0.0.95 to 192.168.1.1 at 2024-11-25 21:41:45
Packet Data: Ether / IP / TCP 10.0.0.95:12362 > 192.168.1.1:http S
[ALERT] SYN Packet detected from 10.0.0.95 to 192.168.1.1 at 2024-11-25 21:41:45
Packet Data: Ether / IP / TCP 10.0.0.95:12363 > 192.168.1.1:http S
[ALERT] SYN Packet detected from 10.0.0.95 to 192.168.1.1 at 2024-11-25 21:41:45
Packet Data: Ether / IP / TCP 10.0.0.95:12364 > 192.168.1.1:http S
[ALERT] SYN Packet detected from 10.0.0.95 to 192.168.1.1 at 2024-11-25 21:41:45
Packet Data: Ether / IP / TCP 10.0.0.95:12365 > 192.168.1.1:http S
[ALERT] SYN Packet detected from 10.0.0.95 to 192.168.1.1 at 2024-11-25 21:41:45
Packet Data: Ether / IP / TCP 10.0.0.95:12366 > 192.168.1.1:http S
[ALERT] SYN Packet detected from 10.0.0.95 to 192.168.1.1 at 2024-11-25 21:41:45
Packet Data: Ether / IP / TCP 10.0.0.95:12367 > 192.168.1.1:http S
[ALERT] SYN Packet detected from 10.0.0.95 to 192.168.1.1 at 2024-11-25 21:41:45
Packet Data: Ether / IP / TCP 10.0.0.95:12368 > 192.168.1.1:http S
[ALERT] SYN Packet detected from 10.0.0.95 to 40.79.141.152 at 2024-11-25 21:41:45
Packet Data: Ether / IP / TCP 10.0.0.95:53806 > 40.79.141.152:https S
[ALERT] SYN Packet detected from 10.0.0.95 to 192.168.1.1 at 2024-11-25 21:41:45
Packet Data: Ether / IP / TCP 10.0.0.95:12369 > 192.168.1.1:http S
[ALERT] SYN Packet detected from 10.0.0.95 to 192.168.1.1 at 2024-11-25 21:41:45
Packet Data: Ether / IP / TCP 10.0.0.95:12370 > 192.168.1.1:http S
[ALERT] SYN Packet detected from 10.0.0.95 to 192.168.1.1 at 2024-11-25 21:41:45
Packet Data: Ether / IP / TCP 10.0.0.95:12371 > 192.168.1.1:http S
[ALERT] SYN Packet detected from 10.0.0.95 to 192.168.1.1 at 2024-11-25 21:41:45
Packet Data: Ether / IP / TCP 10.0.0.95:12372 > 192.168.1.1:http S
[ALERT] SYN Packet detected from 10.0.0.95 to 192.168.1.1 at 2024-11-25 21:41:45
Packet Data: Ether / IP / TCP 10.0.0.95:12373 > 192.168.1.1:http S
[ALERT] SYN Packet detected from 10.0.0.95 to 192.168.1.1 at 2024-11-25 21:41:45
Packet Data: Ether / IP / TCP 10.0.0.95:12374 > 192.168.1.1:http S
[ALERT] SYN Packet detected from 10.0.0.95 to 192.168.1.1 at 2024-11-25 21:41:45
Packet Data: Ether / IP / TCP 10.0.0.95:12375 > 192.168.1.1:http S
[ALERT] SYN Packet detected from 10.0.0.95 to 192.168.1.1 at 2024-11-25 21:41:45
Packet Data: Ether / IP / TCP 10.0.0.95:12376 > 192.168.1.1:http S
[ALERT] SYN Packet detected from 10.0.0.95 to 192.168.1.1 at 2024-11-25 21:41:45
Packet Data: Ether / IP / TCP 10.0.0.95:12377 > 192.168.1.1:http S
[ALERT] SYN Packet detected from 10.0.0.95 to 192.168.1.1 at 2024-11-25 21:41:45
Packet Data: Ether / IP / TCP 10.0.0.95:12378 > 192.168.1.1:http S
[ALERT] SYN Packet detected from 10.0.0.95 to 192.168.1.1 at 2024-11-25 21:41:45
Packet Data: Ether / IP / TCP 10.0.0.95:12379 > 192.168.1.1:http S
[ALERT] SYN Packet detected from 10.0.0.95 to 192.168.1.1 at 2024-11-25 21:41:45
Packet Data: Ether / IP / TCP 10.0.0.95:12380 > 192.168.1.1:http S
[ALERT] SYN Packet detected from 10.0.0.95 to 192.168.1.1 at 2024-11-25 21:41:45
Packet Data: Ether / IP / TCP 10.0.0.95:12381 > 192.168.1.1:http S
[ALERT] SYN Packet detected from 10.0.0.95 to 192.168.1.1 at 2024-11-25 21:41:45
Packet Data: Ether / IP / TCP 10.0.0.95:12382 > 192.168.1.1:http S
[ALERT] SYN Packet detected from 10.0.0.95 to 192.168.1.1 at 2024-11-25 21:41:45
Packet Data: Ether / IP / TCP 10.0.0.95:12383 > 192.168.1.1:http S
[ALERT] SYN Packet detected from 10.0.0.95 to 192.168.1.1 at 2024-11-25 21:41:45
Packet Data: Ether / IP / TCP 10.0.0.95:12384 > 192.168.1.1:http S
[ALERT] SYN Packet detected from 10.0.0.95 to 192.168.1.1 at 2024-11-25 21:41:45
Packet Data: Ether / IP / TCP 10.0.0.95:12385 > 192.168.1.1:http S
[ALERT] SYN Packet detected from 10.0.0.95 to 192.168.1.1 at 2024-11-25 21:41:45
Packet Data: Ether / IP / TCP 10.0.0.95:12386 > 192.168.1.1:http S
[ALERT] SYN Packet detected from 10.0.0.95 to 192.168.1.1 at 2024-11-25 21:41:45
Packet Data: Ether / IP / TCP 10.0.0.95:12387 > 192.168.1.1:http S
[ALERT] SYN Packet detected from 10.0.0.95 to 192.168.1.1 at 2024-11-25 21:41:45
Packet Data: Ether / IP / TCP 10.0.0.95:12388 > 192.168.1.1:http S
[ALERT] SYN Packet detected from 10.0.0.95 to 192.168.1.1 at 2024-11-25 21:41:45
Packet Data: Ether / IP / TCP 10.0.0.95:12389 > 192.168.1.1:http S
[ALERT] SYN Packet detected from 10.0.0.95 to 192.168.1.1 at 2024-11-25 21:41:45
Packet Data: Ether / IP / TCP 10.0.0.95:12390 > 192.168.1.1:http S
[ALERT] SYN Packet detected from 10.0.0.95 to 192.168.1.1 at 2024-11-25 21:41:45
Packet Data: Ether / IP / TCP 10.0.0.95:12391 > 192.168.1.1:http S
[ALERT] SYN Packet detected from 10.0.0.95 to 192.168.1.1 at 2024-11-25 21:41:45
Packet Data: Ether / IP / TCP 10.0.0.95:12392 > 192.168.1.1:http S
[ALERT] SYN Packet detected from 10.0.0.95 to 192.168.1.1 at 2024-11-25 21:41:45
Packet Data: Ether / IP / TCP 10.0.0.95:12393 > 192.168.1.1:http S
[ALERT] SYN Packet detected from 10.0.0.95 to 192.168.1.1 at 2024-11-25 21:41:45
Packet Data: Ether / IP / TCP 10.0.0.95:12394 > 192.168.1.1:http S
[INFO] ICMP Echo Request detected from 10.0.0.95 to 192.168.1.1 at 2024-11-25 21:41:45
Packet Data: Ether / IP / ICMP 10.0.0.95 > 192.168.1.1 echo-request 0
[INFO] ICMP Echo Request detected from 10.0.0.95 to 192.168.1.2 at 2024-11-25 21:41:45
Packet Data: Ether / IP / ICMP 10.0.0.95 > 192.168.1.2 echo-request 0
[INFO] ICMP Echo Request detected from 10.0.0.95 to 192.168.1.3 at 2024-11-25 21:41:45
Packet Data: Ether / IP / ICMP 10.0.0.95 > 192.168.1.3 echo-request 0
[INFO] ICMP Echo Request detected from 10.0.0.95 to 192.168.1.4 at 2024-11-25 21:41:45
Packet Data: Ether / IP / ICMP 10.0.0.95 > 192.168.1.4 echo-request 0
[INFO] ICMP Echo Request detected from 10.0.0.95 to 192.168.1.5 at 2024-11-25 21:41:45
Packet Data: Ether / IP / ICMP 10.0.0.95 > 192.168.1.5 echo-request 0
[INFO] ICMP Echo Request detected from 10.0.0.95 to 192.168.1.6 at 2024-11-25 21:41:45
Packet Data: Ether / IP / ICMP 10.0.0.95 > 192.168.1.6 echo-request 0
[INFO] ICMP Echo Request detected from 10.0.0.95 to 192.168.1.7 at 2024-11-25 21:41:45
Packet Data: Ether / IP / ICMP 10.0.0.95 > 192.168.1.7 echo-request 0
[INFO] ICMP Echo Request detected from 10.0.0.95 to 192.168.1.8 at 2024-11-25 21:41:45
Packet Data: Ether / IP / ICMP 10.0.0.95 > 192.168.1.8 echo-request 0
[INFO] ICMP Echo Request detected from 10.0.0.95 to 192.168.1.9 at 2024-11-25 21:41:45
Packet Data: Ether / IP / ICMP 10.0.0.95 > 192.168.1.9 echo-request 0
[INFO] ICMP Echo Request detected from 10.0.0.95 to 192.168.1.10 at 2024-11-25 21:41:45
Packet Data: Ether / IP / ICMP 10.0.0.95 > 192.168.1.10 echo-request 0
[ALERT] SYN Packet detected from 10.0.0.95 to 52.179.73.52 at 2024-11-25 21:41:58
Packet Data: Ether / IP / TCP 10.0.0.95:53807 > 52.179.73.52:https S
[ALERT] SYN Packet detected from 10.0.0.95 to 44.207.12.154 at 2024-11-25 21:42:15
Packet Data: Ether / IP / TCP 10.0.0.95:53808 > 44.207.12.154:https S
[ALERT] SYN Packet detected from 10.0.0.95 to 75.101.238.2 at 2024-11-25 21:42:16
Packet Data: Ether / IP / TCP 10.0.0.95:53809 > 75.101.238.2:https S
[ALERT] SYN Packet detected from 10.0.0.95 to 152.199.4.33 at 2024-11-25 21:42:25
Packet Data: Ether / IP / TCP 10.0.0.95:53810 > 152.199.4.33:https S
[ALERT] SYN Packet detected from 10.0.0.95 to 35.202.194.70 at 2024-11-25 21:42:43
Packet Data: Ether / IP / TCP 10.0.0.95:53811 > 35.202.194.70:https S
[ALERT] SYN Packet detected from 10.0.0.95 to 52.1.113.157 at 2024-11-25 21:42:49
Packet Data: Ether / IP / TCP 10.0.0.95:53812 > 52.1.113.157:https S
[ALERT] SYN Packet detected from 10.0.0.95 to 52.71.110.220 at 2024-11-25 21:43:06
Packet Data: Ether / IP / TCP 10.0.0.95:53813 > 52.71.110.220:https S
[ALERT] SYN Packet detected from 10.0.0.95 to 18.212.46.235 at 2024-11-25 21:43:06
Packet Data: Ether / IP / TCP 10.0.0.95:53814 > 18.212.46.235:https S
[ALERT] SYN Packet detected from 10.0.0.95 to 104.46.162.227 at 2024-11-25 21:43:20
Packet Data: Ether / IP / TCP 10.0.0.95:53816 > 104.46.162.227:https S
[ALERT] SYN Packet detected from 10.0.0.95 to 44.207.12.154 at 2024-11-25 21:43:21
Packet Data: Ether / IP / TCP 10.0.0.95:53817 > 44.207.12.154:https S
[ALERT] SYN Packet detected from 10.0.0.95 to 75.101.238.2 at 2024-11-25 21:43:21
Packet Data: Ether / IP / TCP 10.0.0.95:53818 > 75.101.238.2:https S
[ALERT] SYN Packet detected from 10.0.0.95 to 20.189.173.17 at 2024-11-25 21:43:22
Packet Data: Ether / IP / TCP 10.0.0.95:53819 > 20.189.173.17:https S
[ALERT] SYN Packet detected from 10.0.0.95 to 52.84.52.102 at 2024-11-25 21:43:57
Packet Data: Ether / IP / TCP 10.0.0.95:53820 > 52.84.52.102:https S
[ALERT] SYN Packet detected from 10.0.0.95 to 52.7.237.141 at 2024-11-25 21:44:06
Packet Data: Ether / IP / TCP 10.0.0.95:53821 > 52.7.237.141:https S
[ALERT] SYN Packet detected from 10.0.0.95 to 34.92.246.241 at 2024-11-25 21:44:20
Packet Data: Ether / IP / TCP 10.0.0.95:53822 > 34.92.246.241:https S
[ALERT] SYN Packet detected from 10.0.0.95 to 35.206.197.180 at 2024-11-25 21:44:21
Packet Data: Ether / IP / TCP 10.0.0.95:53823 > 35.206.197.180:https S
[ALERT] SYN Packet detected from 10.0.0.95 to 13.68.233.9 at 2024-11-25 21:44:38
Packet Data: Ether / IP / TCP 10.0.0.95:53825 > 13.68.233.9:https S
[ALERT] SYN Packet detected from 10.0.0.95 to 4.249.200.148 at 2024-11-25 21:44:50
Packet Data: Ether / IP / TCP 10.0.0.95:53826 > 4.249.200.148:https S
[ALERT] SYN Packet detected from 10.0.0.95 to 20.42.128.98 at 2024-11-25 21:44:50
Packet Data: Ether / IP / TCP 10.0.0.95:53829 > 20.42.128.98:https S
[ALERT] SYN Packet detected from 10.0.0.95 to 20.49.19.163 at 2024-11-25 21:44:51
Packet Data: Ether / IP / TCP 10.0.0.95:53830 > 20.49.19.163:https S
[ALERT] SYN Packet detected from 10.0.0.95 to 20.189.173.15 at 2024-11-25 21:44:53
Packet Data: Ether / IP / TCP 10.0.0.95:53834 > 20.189.173.15:https S
[ALERT] SYN Packet detected from 10.0.0.95 to 20.42.128.98 at 2024-11-25 21:44:54
Packet Data: Ether / IP / TCP 10.0.0.95:53835 > 20.42.128.98:https S
[ALERT] SYN Packet detected from 10.0.0.95 to 13.107.5.88 at 2024-11-25 21:44:55
Packet Data: Ether / IP / TCP 10.0.0.95:53838 > 13.107.5.88:https S
[ALERT] SYN Packet detected from 10.0.0.95 to 20.189.173.1 at 2024-11-25 21:44:56
Packet Data: Ether / IP / TCP 10.0.0.95:53840 > 20.189.173.1:https S
[ALERT] SYN Packet detected from 10.0.0.95 to 13.107.5.88 at 2024-11-25 21:44:59
Packet Data: Ether / IP / TCP 10.0.0.95:53849 > 13.107.5.88:https S
[ALERT] SYN Packet detected from 10.0.0.95 to 13.85.16.224 at 2024-11-25 21:44:59
Packet Data: Ether / IP / TCP 10.0.0.95:53852 > 13.85.16.224:https S
[ALERT] SYN Packet detected from 10.0.0.95 to 23.197.210.4 at 2024-11-25 21:45:00
Packet Data: Ether / IP / TCP 10.0.0.95:53855 > 23.197.210.4:https S
[ALERT] SYN Packet detected from 10.0.0.95 to 20.189.173.1 at 2024-11-25 21:45:00
Packet Data: Ether / IP / TCP 10.0.0.95:53856 > 20.189.173.1:https S
[ALERT] SYN Packet detected from 10.0.0.95 to 40.126.29.13 at 2024-11-25 21:45:05
Packet Data: Ether / IP / TCP 10.0.0.95:53870 > 40.126.29.13:https S
[ALERT] SYN Packet detected from 10.0.0.95 to 40.84.185.67 at 2024-11-25 21:45:07
Packet Data: Ether / IP / TCP 10.0.0.95:53873 > 40.84.185.67:9354 S
[ALERT] SYN Packet detected from 10.0.0.95 to 40.84.185.67 at 2024-11-25 21:45:08
Packet Data: Ether / IP / TCP 10.0.0.95:53874 > 40.84.185.67:9354 S
[ALERT] SYN Packet detected from 10.0.0.95 to 20.42.73.28 at 2024-11-25 21:45:24
Packet Data: Ether / IP / TCP 10.0.0.95:53876 > 20.42.73.28:https S
[ALERT] SYN Packet detected from 10.0.0.95 to 52.7.237.141 at 2024-11-25 21:45:31
Packet Data: Ether / IP / TCP 10.0.0.95:53877 > 52.7.237.141:https S
[ALERT] SYN Packet detected from 10.0.0.95 to 104.46.162.225 at 2024-11-25 21:45:33
Packet Data: Ether / IP / TCP 10.0.0.95:53878 > 104.46.162.225:https S
[ALERT] SYN Packet detected from 10.0.0.95 to 35.202.194.70 at 2024-11-25 21:45:43
Packet Data: Ether / IP / TCP 10.0.0.95:53880 > 35.202.194.70:https S
[ALERT] SYN Packet detected from 10.0.0.95 to 52.85.247.117 at 2024-11-25 21:45:44
Packet Data: Ether / IP / TCP 10.0.0.95:53881 > 52.85.247.117:https S
[ALERT] SYN Packet detected from 10.0.0.95 to 20.189.173.3 at 2024-11-25 21:46:05
Packet Data: Ether / IP / TCP 10.0.0.95:53885 > 20.189.173.3:https S
[ALERT] SYN Packet detected from 10.0.0.95 to 20.42.73.24 at 2024-11-25 21:46:27
Packet Data: Ether / IP / TCP 10.0.0.95:53889 > 20.42.73.24:https S
[ALERT] SYN Packet detected from 10.0.0.95 to 20.49.19.163 at 2024-11-25 21:46:39
Packet Data: Ether / IP / TCP 10.0.0.95:53891 > 20.49.19.163:https S
[ALERT] SYN Packet detected from 10.0.0.95 to 35.170.7.69 at 2024-11-25 21:46:39
Packet Data: Ether / IP / TCP 10.0.0.95:53892 > 35.170.7.69:https S
[ALERT] SYN Packet detected from 10.0.0.95 to 20.42.65.93 at 2024-11-25 21:46:40
Packet Data: Ether / IP / TCP 10.0.0.95:53893 > 20.42.65.93:https S
[ALERT] SYN Packet detected from 10.0.0.95 to 44.216.68.199 at 2024-11-25 21:46:53
Packet Data: Ether / IP / TCP 10.0.0.95:53894 > 44.216.68.199:https S
[ALERT] SYN Packet detected from 10.0.0.95 to 44.216.68.199 at 2024-11-25 21:47:19
Packet Data: Ether / IP / TCP 10.0.0.95:53896 > 44.216.68.199:https S
[ALERT] SYN Packet detected from 10.0.0.95 to 152.199.4.33 at 2024-11-25 21:47:25
Packet Data: Ether / IP / TCP 10.0.0.95:53897 > 152.199.4.33:https S
[ALERT] SYN Packet detected from 10.0.0.95 to 20.189.173.12 at 2024-11-25 21:47:39
Packet Data: Ether / IP / TCP 10.0.0.95:53898 > 20.189.173.12:https S
[ALERT] SYN Packet detected from 10.0.0.95 to 140.82.114.3 at 2024-11-25 21:47:42
Packet Data: Ether / IP / TCP 10.0.0.95:53899 > 140.82.114.3:https S
[ALERT] SYN Packet detected from 10.0.0.95 to 185.199.108.154 at 2024-11-25 21:47:42
Packet Data: Ether / IP / TCP 10.0.0.95:53900 > 185.199.108.154:https S
[ALERT] SYN Packet detected from 10.0.0.95 to 185.199.108.154 at 2024-11-25 21:47:43
Packet Data: Ether / IP / TCP 10.0.0.95:53901 > 185.199.108.154:https S
[ALERT] SYN Packet detected from 10.0.0.95 to 140.82.113.26 at 2024-11-25 21:47:44
Packet Data: Ether / IP / TCP 10.0.0.95:53904 > 140.82.113.26:https S
[ALERT] SYN Packet detected from 10.0.0.95 to 140.82.113.22 at 2024-11-25 21:47:45
Packet Data: Ether / IP / TCP 10.0.0.95:53905 > 140.82.113.22:https S
[ALERT] SYN Packet detected from 10.0.0.95 to 140.82.113.6 at 2024-11-25 21:47:46
Packet Data: Ether / IP / TCP 10.0.0.95:53906 > 140.82.113.6:https S
[ALERT] SYN Packet detected from 10.0.0.95 to 35.170.7.69 at 2024-11-25 21:47:49
Packet Data: Ether / IP / TCP 10.0.0.95:53907 > 35.170.7.69:https S
[ALERT] SYN Packet detected from 10.0.0.95 to 13.68.233.9 at 2024-11-25 21:48:03
Packet Data: Ether / IP / TCP 10.0.0.95:53908 > 13.68.233.9:https S
[ALERT] SYN Packet detected from 10.0.0.95 to 20.189.173.26 at 2024-11-25 21:48:19
Packet Data: Ether / IP / TCP 10.0.0.95:53909 > 20.189.173.26:https S
[ALERT] SYN Packet detected from 10.0.0.95 to 52.168.112.66 at 2024-11-25 21:48:26
Packet Data: Ether / IP / TCP 10.0.0.95:53910 > 52.168.112.66:https S
[ALERT] SYN Packet detected from 10.0.0.95 to 44.216.68.199 at 2024-11-25 21:48:48
Packet Data: Ether / IP / TCP 10.0.0.95:53915 > 44.216.68.199:https S
[ALERT] SYN Packet detected from 10.0.0.95 to 100.25.81.157 at 2024-11-25 21:48:48
Packet Data: Ether / IP / TCP 10.0.0.95:53916 > 100.25.81.157:https S
[ALERT] SYN Packet detected from 10.0.0.95 to 34.193.116.189 at 2024-11-25 21:48:50
Packet Data: Ether / IP / TCP 10.0.0.95:53917 > 34.193.116.189:https S
[ALERT] SYN Packet detected from 10.0.0.95 to 140.82.112.4 at 2024-11-25 21:48:50
Packet Data: Ether / IP / TCP 10.0.0.95:53918 > 140.82.112.4:https S
[ALERT] SYN Packet detected from 10.0.0.95 to 52.112.95.131 at 2024-11-25 21:48:50
Packet Data: Ether / IP / TCP 10.0.0.95:53919 > 52.112.95.131:https S
[ALERT] SYN Packet detected from 10.0.0.95 to 185.199.108.154 at 2024-11-25 21:48:53
Packet Data: Ether / IP / TCP 10.0.0.95:53922 > 185.199.108.154:https S
[ALERT] SYN Packet detected from 10.0.0.95 to 140.82.114.6 at 2024-11-25 21:48:55
Packet Data: Ether / IP / TCP 10.0.0.95:53923 > 140.82.114.6:https S
[ALERT] SYN Packet detected from 10.0.0.95 to 99.84.160.48 at 2024-11-25 21:49:41
Packet Data: Ether / IP / TCP 10.0.0.95:53926 > 99.84.160.48:https S
[ALERT] SYN Packet detected from 10.0.0.95 to 18.223.8.252 at 2024-11-25 21:49:45
Packet Data: Ether / IP / TCP 10.0.0.95:53928 > 18.223.8.252:https S
[ALERT] SYN Packet detected from 10.0.0.95 to 162.247.243.29 at 2024-11-25 21:49:46
Packet Data: Ether / IP / TCP 10.0.0.95:53930 > 162.247.243.29:https S
[ALERT] SYN Packet detected from 10.0.0.95 to 162.247.243.29 at 2024-11-25 21:49:46
Packet Data: Ether / IP / TCP 10.0.0.95:53931 > 162.247.243.29:https S
[ALERT] SYN Packet detected from 10.0.0.95 to 162.247.243.29 at 2024-11-25 21:49:46
Packet Data: Ether / IP / TCP 10.0.0.95:53932 > 162.247.243.29:https S
[ALERT] SYN Packet detected from 10.0.0.95 to 162.247.243.29 at 2024-11-25 21:49:46
Packet Data: Ether / IP / TCP 10.0.0.95:53933 > 162.247.243.29:https S
[ALERT] SYN Packet detected from 10.0.0.95 to 34.193.116.189 at 2024-11-25 21:49:50
Packet Data: Ether / IP / TCP 10.0.0.95:53934 > 34.193.116.189:https S
[ALERT] SYN Packet detected from 10.0.0.95 to 52.182.143.215 at 2024-11-25 21:50:26
Packet Data: Ether / IP / TCP 10.0.0.95:53936 > 52.182.143.215:https S
[ALERT] SYN Packet detected from 10.0.0.95 to 40.70.76.27 at 2024-11-25 21:50:38
Packet Data: Ether / IP / TCP 10.0.0.95:53937 > 40.70.76.27:https S
[ALERT] SYN Packet detected from 10.0.0.95 to 52.85.247.100 at 2024-11-25 21:50:44
Packet Data: Ether / IP / TCP 10.0.0.95:53939 > 52.85.247.100:https S
[ALERT] SYN Packet detected from 10.0.0.95 to 34.193.116.189 at 2024-11-25 21:50:52
Packet Data: Ether / IP / TCP 10.0.0.95:53941 > 34.193.116.189:https S
[ALERT] SYN Packet detected from 10.0.0.95 to 162.247.243.29 at 2024-11-25 21:51:10
Packet Data: Ether / IP / TCP 10.0.0.95:53942 > 162.247.243.29:https S
[ALERT] SYN Packet detected from 10.0.0.95 to 99.84.160.58 at 2024-11-25 21:51:20
Packet Data: Ether / IP / TCP 10.0.0.95:53944 > 99.84.160.58:https S
[ALERT] SYN Packet detected from 10.0.0.95 to 35.202.194.70 at 2024-11-25 21:51:30
Packet Data: Ether / IP / TCP 10.0.0.95:53946 > 35.202.194.70:https S
[ALERT] SYN Packet detected from 10.0.0.95 to 34.120.202.204 at 2024-11-25 21:51:31
Packet Data: Ether / IP / TCP 10.0.0.95:53949 > 34.120.202.204:https S
[ALERT] SYN Packet detected from 10.0.0.95 to 162.159.140.229 at 2024-11-25 21:51:34
Packet Data: Ether / IP / TCP 10.0.0.95:53953 > 162.159.140.229:https S
[ALERT] SYN Packet detected from 10.0.0.95 to 104.244.42.195 at 2024-11-25 21:51:34
Packet Data: Ether / IP / TCP 10.0.0.95:53954 > 104.244.42.195:https S
[ALERT] SYN Packet detected from 10.0.0.95 to 104.18.36.46 at 2024-11-25 21:51:34
Packet Data: Ether / IP / TCP 10.0.0.95:53955 > 104.18.36.46:https S
[ALERT] SYN Packet detected from 10.0.0.95 to 104.208.16.92 at 2024-11-25 21:51:36
Packet Data: Ether / IP / TCP 10.0.0.95:53962 > 104.208.16.92:https S
[ALERT] SYN Packet detected from 10.0.0.95 to 20.42.73.24 at 2024-11-25 21:51:36
Packet Data: Ether / IP / TCP 10.0.0.95:53963 > 20.42.73.24:https S
[ALERT] SYN Packet detected from 10.0.0.95 to 52.203.86.128 at 2024-11-25 21:51:37
Packet Data: Ether / IP / TCP 10.0.0.95:53964 > 52.203.86.128:https S
[ALERT] SYN Packet detected from 10.0.0.95 to 54.87.94.142 at 2024-11-25 21:51:37
Packet Data: Ether / IP / TCP 10.0.0.95:53965 > 54.87.94.142:https S
[ALERT] SYN Packet detected from 10.0.0.95 to 34.226.226.231 at 2024-11-25 21:51:38
Packet Data: Ether / IP / TCP 10.0.0.95:53966 > 34.226.226.231:https S
[ALERT] SYN Packet detected from 10.0.0.95 to 20.49.19.163 at 2024-11-25 21:51:39
Packet Data: Ether / IP / TCP 10.0.0.95:53967 > 20.49.19.163:https S
[ALERT] SYN Packet detected from 10.0.0.95 to 151.101.193.91 at 2024-11-25 21:51:40
Packet Data: Ether / IP / TCP 10.0.0.95:53968 > 151.101.193.91:https S
[ALERT] SYN Packet detected from 10.0.0.95 to 51.104.15.252 at 2024-11-25 21:51:40
Packet Data: Ether / IP / TCP 10.0.0.95:53969 > 51.104.15.252:https S
[ALERT] SYN Packet detected from 10.0.0.95 to 52.203.86.128 at 2024-11-25 21:51:41
Packet Data: Ether / IP / TCP 10.0.0.95:53970 > 52.203.86.128:https S
[ALERT] SYN Packet detected from 10.0.0.95 to 52.84.52.97 at 2024-11-25 21:51:41
Packet Data: Ether / IP / TCP 10.0.0.95:53971 > 52.84.52.97:https S
[ALERT] SYN Packet detected from 10.0.0.95 to 54.186.23.98 at 2024-11-25 21:51:42
Packet Data: Ether / IP / TCP 10.0.0.95:53972 > 54.186.23.98:https S
[ALERT] SYN Packet detected from 10.0.0.95 to 54.186.23.98 at 2024-11-25 21:51:44
Packet Data: Ether / IP / TCP 10.0.0.95:53973 > 54.186.23.98:https S
[ALERT] SYN Packet detected from 10.0.0.95 to 54.88.208.230 at 2024-11-25 21:51:45
Packet Data: Ether / IP / TCP 10.0.0.95:53974 > 54.88.208.230:https S
[ALERT] SYN Packet detected from 10.0.0.95 to 54.87.94.142 at 2024-11-25 21:51:45
Packet Data: Ether / IP / TCP 10.0.0.95:53975 > 54.87.94.142:https S
[ALERT] SYN Packet detected from 10.0.0.95 to 3.225.53.246 at 2024-11-25 21:51:45
Packet Data: Ether / IP / TCP 10.0.0.95:53976 > 3.225.53.246:https S
[ALERT] SYN Packet detected from 10.0.0.95 to 20.50.80.210 at 2024-11-25 21:51:46
Packet Data: Ether / IP / TCP 10.0.0.95:53981 > 20.50.80.210:https S
[ALERT] SYN Packet detected from 10.0.0.95 to 20.42.73.24 at 2024-11-25 21:51:46
Packet Data: Ether / IP / TCP 10.0.0.95:53982 > 20.42.73.24:https S
[ALERT] SYN Packet detected from 10.0.0.95 to 104.208.16.91 at 2024-11-25 21:51:46
Packet Data: Ether / IP / TCP 10.0.0.95:53983 > 104.208.16.91:https S
[ALERT] SYN Packet detected from 10.0.0.95 to 20.42.73.24 at 2024-11-25 21:51:48
Packet Data: Ether / IP / TCP 10.0.0.95:53986 > 20.42.73.24:https S
[ALERT] SYN Packet detected from 10.0.0.95 to 52.178.17.2 at 2024-11-25 21:51:48
Packet Data: Ether / IP / TCP 10.0.0.95:53987 > 52.178.17.2:https S
[ALERT] SYN Packet detected from 10.0.0.95 to 104.208.16.92 at 2024-11-25 21:51:51
Packet Data: Ether / IP / TCP 10.0.0.95:53988 > 104.208.16.92:https S
[ALERT] SYN Packet detected from 10.0.0.95 to 140.82.114.5 at 2024-11-25 21:51:52
Packet Data: Ether / IP / TCP 10.0.0.95:53989 > 140.82.114.5:https S
[ALERT] SYN Packet detected from 10.0.0.95 to 34.193.116.189 at 2024-11-25 21:51:53
Packet Data: Ether / IP / TCP 10.0.0.95:53990 > 34.193.116.189:https S
[ALERT] SYN Packet detected from 10.0.0.95 to 140.82.113.22 at 2024-11-25 21:51:55
Packet Data: Ether / IP / TCP 10.0.0.95:53991 > 140.82.113.22:https S
[ALERT] SYN Packet detected from 10.0.0.95 to 99.84.160.58 at 2024-11-25 21:52:04
Packet Data: Ether / IP / TCP 10.0.0.95:53995 > 99.84.160.58:https S
[ALERT] SYN Packet detected from 10.0.0.95 to 172.183.192.109 at 2024-11-25 21:52:20
Packet Data: Ether / IP / TCP 10.0.0.95:54011 > 172.183.192.109:https S
[ALERT] SYN Packet detected from 10.0.0.95 to 20.49.19.163 at 2024-11-25 21:52:24
Packet Data: Ether / IP / TCP 10.0.0.95:54016 > 20.49.19.163:https S
[ALERT] SYN Packet detected from 10.0.0.95 to 20.49.43.163 at 2024-11-25 21:52:25
Packet Data: Ether / IP / TCP 10.0.0.95:54017 > 20.49.43.163:https S
[ALERT] SYN Packet detected from 10.0.0.95 to 20.49.43.163 at 2024-11-25 21:52:25
Packet Data: Ether / IP / TCP 10.0.0.95:54019 > 20.49.43.163:https S
[ALERT] SYN Packet detected from 10.0.0.95 to 20.49.19.163 at 2024-11-25 21:52:26
Packet Data: Ether / IP / TCP 10.0.0.95:54021 > 20.49.19.163:https S
[ALERT] SYN Packet detected from 10.0.0.95 to 3.235.96.60 at 2024-11-25 21:52:26
Packet Data: Ether / IP / TCP 10.0.0.95:54022 > 3.235.96.60:https S
[ALERT] SYN Packet detected from 10.0.0.95 to 151.101.1.91 at 2024-11-25 21:52:26
Packet Data: Ether / IP / TCP 10.0.0.95:54026 > 151.101.1.91:http S
[ALERT] SYN Packet detected from 10.0.0.95 to 151.101.1.91 at 2024-11-25 21:52:26
Packet Data: Ether / IP / TCP 10.0.0.95:54027 > 151.101.1.91:http S
[ALERT] SYN Packet detected from 10.0.0.95 to 20.50.73.9 at 2024-11-25 21:52:27
Packet Data: Ether / IP / TCP 10.0.0.95:54033 > 20.50.73.9:https S
[ALERT] SYN Packet detected from 10.0.0.95 to 20.49.19.163 at 2024-11-25 21:52:27
Packet Data: Ether / IP / TCP 10.0.0.95:54034 > 20.49.19.163:https S
[ALERT] SYN Packet detected from 10.0.0.95 to 152.199.4.33 at 2024-11-25 21:52:27
Packet Data: Ether / IP / TCP 10.0.0.95:54035 > 152.199.4.33:https S
[ALERT] SYN Packet detected from 10.0.0.95 to 152.199.4.33 at 2024-11-25 21:52:27
Packet Data: Ether / IP / TCP 10.0.0.95:54036 > 152.199.4.33:https S
[ALERT] SYN Packet detected from 10.0.0.95 to 104.46.162.225 at 2024-11-25 21:52:28
Packet Data: Ether / IP / TCP 10.0.0.95:54037 > 104.46.162.225:https S
[ALERT] SYN Packet detected from 10.0.0.95 to 20.49.19.163 at 2024-11-25 21:52:28
Packet Data: Ether / IP / TCP 10.0.0.95:54038 > 20.49.19.163:https S
[ALERT] SYN Packet detected from 10.0.0.95 to 134.224.240.221 at 2024-11-25 21:52:30
Packet Data: Ether / IP / TCP 10.0.0.95:54048 > 134.224.240.221:https S
[ALERT] SYN Packet detected from 10.0.0.95 to 170.114.52.38 at 2024-11-25 21:52:31
Packet Data: Ether / IP / TCP 10.0.0.95:54050 > 170.114.52.38:https S
[ALERT] SYN Packet detected from 10.0.0.95 to 170.114.52.38 at 2024-11-25 21:52:35
Packet Data: Ether / IP / TCP 10.0.0.95:54058 > 170.114.52.38:https S
[ALERT] SYN Packet detected from 10.0.0.95 to 170.114.52.38 at 2024-11-25 21:52:37
Packet Data: Ether / IP / TCP 10.0.0.95:54064 > 170.114.52.38:https S
[ALERT] SYN Packet detected from 10.0.0.95 to 144.195.5.254 at 2024-11-25 21:52:39
Packet Data: Ether / IP / TCP 10.0.0.95:54069 > 144.195.5.254:https S
[ALERT] SYN Packet detected from 10.0.0.95 to 144.195.34.253 at 2024-11-25 21:52:39
Packet Data: Ether / IP / TCP 10.0.0.95:54070 > 144.195.34.253:https S
[ALERT] SYN Packet detected from 10.0.0.95 to 144.195.35.253 at 2024-11-25 21:52:39
Packet Data: Ether / IP / TCP 10.0.0.95:54071 > 144.195.35.253:https S
[ALERT] SYN Packet detected from 10.0.0.95 to 144.195.11.254 at 2024-11-25 21:52:39
Packet Data: Ether / IP / TCP 10.0.0.95:54072 > 144.195.11.254:https S
[ALERT] SYN Packet detected from 10.0.0.95 to 144.195.35.77 at 2024-11-25 21:52:39
Packet Data: Ether / IP / TCP 10.0.0.95:54073 > 144.195.35.77:https S
[ALERT] SYN Packet detected from 10.0.0.95 to 144.195.35.77 at 2024-11-25 21:52:40
Packet Data: Ether / IP / TCP 10.0.0.95:54074 > 144.195.35.77:https S
[ALERT] SYN Packet detected from 10.0.0.95 to 23.204.53.201 at 2024-11-25 21:53:09
Packet Data: Ether / IP / TCP 10.0.0.95:54077 > 23.204.53.201:http S
[ALERT] SYN Packet detected from 10.0.0.95 to 52.167.167.111 at 2024-11-25 21:53:14
Packet Data: Ether / IP / TCP 10.0.0.95:54078 > 52.167.167.111:https S
[ALERT] SYN Packet detected from 10.0.0.95 to 10.0.0.1 at 2024-11-25 21:53:31
Packet Data: Ether / IP / TCP 10.0.0.95:54083 > 10.0.0.1:49152 S
[ALERT] SYN Packet detected from 10.0.0.95 to 10.0.0.1 at 2024-11-25 21:53:35
Packet Data: Ether / IP / TCP 10.0.0.95:54086 > 10.0.0.1:49152 S
[ALERT] SYN Packet detected from 10.0.0.95 to 10.0.0.1 at 2024-11-25 21:53:35
Packet Data: Ether / IP / TCP 10.0.0.95:54087 > 10.0.0.1:49152 S
[ALERT] SYN Packet detected from 10.0.0.1 to 10.0.0.95 at 2024-11-25 21:53:35
Packet Data: Ether / IP / TCP 10.0.0.1:38750 > 10.0.0.95:icslap S
[ALERT] SYN Packet detected from 10.0.0.95 to 10.0.0.1 at 2024-11-25 21:53:35
Packet Data: Ether / IP / TCP 10.0.0.95:54088 > 10.0.0.1:49152 S
[ALERT] SYN Packet detected from 10.0.0.95 to 10.0.0.1 at 2024-11-25 21:53:35
Packet Data: Ether / IP / TCP 10.0.0.95:54089 > 10.0.0.1:49152 S
[ALERT] SYN Packet detected from 10.0.0.1 to 10.0.0.95 at 2024-11-25 21:53:36
Packet Data: Ether / IP / TCP 10.0.0.1:38750 > 10.0.0.95:icslap S
[ALERT] SYN Packet detected from 10.0.0.1 to 10.0.0.95 at 2024-11-25 21:53:38
Packet Data: Ether / IP / TCP 10.0.0.1:38750 > 10.0.0.95:icslap S
[ALERT] SYN Packet detected from 10.0.0.95 to 10.0.0.1 at 2024-11-25 21:53:40
Packet Data: Ether / IP / TCP 10.0.0.95:54090 > 10.0.0.1:49152 S
[ALERT] SYN Packet detected from 10.0.0.95 to 10.0.0.1 at 2024-11-25 21:53:40
Packet Data: Ether / IP / TCP 10.0.0.95:54091 > 10.0.0.1:49152 S
[ALERT] SYN Packet detected from 10.0.0.1 to 10.0.0.95 at 2024-11-25 21:53:40
Packet Data: Ether / IP / TCP 10.0.0.1:38764 > 10.0.0.95:icslap S
[ALERT] SYN Packet detected from 10.0.0.95 to 10.0.0.1 at 2024-11-25 21:53:40
Packet Data: Ether / IP / TCP 10.0.0.95:54092 > 10.0.0.1:49152 S
[ALERT] SYN Packet detected from 10.0.0.95 to 10.0.0.1 at 2024-11-25 21:53:40
Packet Data: Ether / IP / TCP 10.0.0.95:54093 > 10.0.0.1:49152 S
[ALERT] SYN Packet detected from 10.0.0.95 to 10.0.0.1 at 2024-11-25 21:53:40
Packet Data: Ether / IP / TCP 10.0.0.95:54094 > 10.0.0.1:49152 S
[ALERT] SYN Packet detected from 10.0.0.95 to 10.0.0.1 at 2024-11-25 21:53:40
Packet Data: Ether / IP / TCP 10.0.0.95:54095 > 10.0.0.1:49152 S
[ALERT] SYN Packet detected from 10.0.0.95 to 10.0.0.1 at 2024-11-25 21:53:40
Packet Data: Ether / IP / TCP 10.0.0.95:54096 > 10.0.0.1:49152 S
[ALERT] SYN Packet detected from 10.0.0.95 to 10.0.0.1 at 2024-11-25 21:53:40
Packet Data: Ether / IP / TCP 10.0.0.95:54097 > 10.0.0.1:49152 S
[ALERT] SYN Packet detected from 10.0.0.95 to 10.0.0.1 at 2024-11-25 21:53:41
Packet Data: Ether / IP / TCP 10.0.0.95:54098 > 10.0.0.1:49152 S
[ALERT] SYN Packet detected from 10.0.0.1 to 10.0.0.95 at 2024-11-25 21:53:41
Packet Data: Ether / IP / TCP 10.0.0.1:38764 > 10.0.0.95:icslap S
[ALERT] SYN Packet detected from 10.0.0.95 to 10.0.0.1 at 2024-11-25 21:53:41
Packet Data: Ether / IP / TCP 10.0.0.95:54099 > 10.0.0.1:49152 S
[ALERT] SYN Packet detected from 10.0.0.95 to 10.0.0.1 at 2024-11-25 21:53:41
Packet Data: Ether / IP / TCP 10.0.0.95:54100 > 10.0.0.1:49152 S
[ALERT] SYN Packet detected from 10.0.0.95 to 10.0.0.1 at 2024-11-25 21:53:41
Packet Data: Ether / IP / TCP 10.0.0.95:54101 > 10.0.0.1:49152 S
[ALERT] SYN Packet detected from 10.0.0.95 to 10.0.0.1 at 2024-11-25 21:53:41
Packet Data: Ether / IP / TCP 10.0.0.95:54102 > 10.0.0.1:49152 S
[ALERT] SYN Packet detected from 10.0.0.95 to 10.0.0.1 at 2024-11-25 21:53:42
Packet Data: Ether / IP / TCP 10.0.0.95:54103 > 10.0.0.1:49152 S
[ALERT] SYN Packet detected from 10.0.0.95 to 10.0.0.1 at 2024-11-25 21:53:42
Packet Data: Ether / IP / TCP 10.0.0.95:54104 > 10.0.0.1:49152 S
[ALERT] SYN Packet detected from 10.0.0.95 to 10.0.0.1 at 2024-11-25 21:53:42
Packet Data: Ether / IP / TCP 10.0.0.95:54105 > 10.0.0.1:49152 S
[ALERT] SYN Packet detected from 10.0.0.95 to 10.0.0.1 at 2024-11-25 21:53:42
Packet Data: Ether / IP / TCP 10.0.0.95:54106 > 10.0.0.1:49152 S
[ALERT] SYN Packet detected from 10.0.0.1 to 10.0.0.95 at 2024-11-25 21:53:43
Packet Data: Ether / IP / TCP 10.0.0.1:38764 > 10.0.0.95:icslap S
[ALERT] SYN Packet detected from 10.0.0.95 to 10.0.0.1 at 2024-11-25 21:53:43
Packet Data: Ether / IP / TCP 10.0.0.95:54107 > 10.0.0.1:49152 S
[ALERT] SYN Packet detected from 10.0.0.95 to 10.0.0.1 at 2024-11-25 21:53:43
Packet Data: Ether / IP / TCP 10.0.0.95:54108 > 10.0.0.1:49152 S
[ALERT] SYN Packet detected from 10.0.0.95 to 10.0.0.1 at 2024-11-25 21:53:43
Packet Data: Ether / IP / TCP 10.0.0.95:54109 > 10.0.0.1:49152 S
[ALERT] SYN Packet detected from 10.0.0.95 to 10.0.0.1 at 2024-11-25 21:53:43
Packet Data: Ether / IP / TCP 10.0.0.95:54110 > 10.0.0.1:49152 S
[ALERT] SYN Packet detected from 10.0.0.95 to 10.0.0.1 at 2024-11-25 21:53:44
Packet Data: Ether / IP / TCP 10.0.0.95:54111 > 10.0.0.1:49152 S
[ALERT] SYN Packet detected from 10.0.0.95 to 10.0.0.1 at 2024-11-25 21:53:44
Packet Data: Ether / IP / TCP 10.0.0.95:54112 > 10.0.0.1:49152 S
[ALERT] SYN Packet detected from 10.0.0.95 to 10.0.0.1 at 2024-11-25 21:53:44
Packet Data: Ether / IP / TCP 10.0.0.95:54113 > 10.0.0.1:49152 S
[ALERT] SYN Packet detected from 10.0.0.95 to 10.0.0.1 at 2024-11-25 21:53:44
Packet Data: Ether / IP / TCP 10.0.0.95:54114 > 10.0.0.1:49152 S
[ALERT] SYN Packet detected from 10.0.0.95 to 10.0.0.1 at 2024-11-25 21:53:45
Packet Data: Ether / IP / TCP 10.0.0.95:54115 > 10.0.0.1:49152 S
[ALERT] SYN Packet detected from 10.0.0.95 to 10.0.0.1 at 2024-11-25 21:53:45
Packet Data: Ether / IP / TCP 10.0.0.95:54116 > 10.0.0.1:49152 S
[ALERT] SYN Packet detected from 10.0.0.95 to 10.0.0.1 at 2024-11-25 21:53:45
Packet Data: Ether / IP / TCP 10.0.0.95:54117 > 10.0.0.1:49152 S
[ALERT] SYN Packet detected from 10.0.0.95 to 10.0.0.1 at 2024-11-25 21:53:45
Packet Data: Ether / IP / TCP 10.0.0.95:54118 > 10.0.0.1:49152 S
[ALERT] SYN Packet detected from 10.0.0.95 to 10.0.0.1 at 2024-11-25 21:53:45
Packet Data: Ether / IP / TCP 10.0.0.95:54119 > 10.0.0.1:49152 S
[ALERT] SYN Packet detected from 10.0.0.95 to 10.0.0.1 at 2024-11-25 21:53:45
Packet Data: Ether / IP / TCP 10.0.0.95:54120 > 10.0.0.1:49152 S
[ALERT] SYN Packet detected from 10.0.0.95 to 10.0.0.1 at 2024-11-25 21:53:45
Packet Data: Ether / IP / TCP 10.0.0.95:54121 > 10.0.0.1:49152 S
[ALERT] SYN Packet detected from 10.0.0.95 to 10.0.0.1 at 2024-11-25 21:53:45
Packet Data: Ether / IP / TCP 10.0.0.95:54122 > 10.0.0.1:49152 S
[ALERT] SYN Packet detected from 10.0.0.95 to 10.0.0.1 at 2024-11-25 21:53:46
Packet Data: Ether / IP / TCP 10.0.0.95:54123 > 10.0.0.1:49152 S
[ALERT] SYN Packet detected from 10.0.0.95 to 10.0.0.1 at 2024-11-25 21:53:46
Packet Data: Ether / IP / TCP 10.0.0.95:54124 > 10.0.0.1:49152 S
[ALERT] SYN Packet detected from 10.0.0.95 to 10.0.0.1 at 2024-11-25 21:53:46
Packet Data: Ether / IP / TCP 10.0.0.95:54125 > 10.0.0.1:49152 S
[ALERT] SYN Packet detected from 10.0.0.95 to 10.0.0.1 at 2024-11-25 21:53:46
Packet Data: Ether / IP / TCP 10.0.0.95:54126 > 10.0.0.1:49152 S
[ALERT] SYN Packet detected from 10.0.0.95 to 10.0.0.1 at 2024-11-25 21:53:47
Packet Data: Ether / IP / TCP 10.0.0.95:54127 > 10.0.0.1:49152 S
[ALERT] SYN Packet detected from 10.0.0.95 to 10.0.0.1 at 2024-11-25 21:53:47
Packet Data: Ether / IP / TCP 10.0.0.95:54128 > 10.0.0.1:49152 S
[ALERT] SYN Packet detected from 10.0.0.95 to 10.0.0.1 at 2024-11-25 21:53:47
Packet Data: Ether / IP / TCP 10.0.0.95:54129 > 10.0.0.1:49152 S
[ALERT] SYN Packet detected from 10.0.0.95 to 10.0.0.1 at 2024-11-25 21:53:47
Packet Data: Ether / IP / TCP 10.0.0.95:54130 > 10.0.0.1:49152 S
[ALERT] SYN Packet detected from 10.0.0.95 to 10.0.0.1 at 2024-11-25 21:53:47
Packet Data: Ether / IP / TCP 10.0.0.95:54131 > 10.0.0.1:49152 S
[ALERT] SYN Packet detected from 10.0.0.95 to 10.0.0.1 at 2024-11-25 21:53:47
Packet Data: Ether / IP / TCP 10.0.0.95:54132 > 10.0.0.1:49152 S
[ALERT] SYN Packet detected from 10.0.0.95 to 10.0.0.1 at 2024-11-25 21:53:47
Packet Data: Ether / IP / TCP 10.0.0.95:54133 > 10.0.0.1:49152 S
[ALERT] SYN Packet detected from 10.0.0.95 to 10.0.0.1 at 2024-11-25 21:53:47
Packet Data: Ether / IP / TCP 10.0.0.95:54134 > 10.0.0.1:49152 S
[ALERT] SYN Packet detected from 10.0.0.95 to 10.0.0.1 at 2024-11-25 21:53:48
Packet Data: Ether / IP / TCP 10.0.0.95:54135 > 10.0.0.1:49152 S
[ALERT] SYN Packet detected from 10.0.0.95 to 10.0.0.1 at 2024-11-25 21:53:48
Packet Data: Ether / IP / TCP 10.0.0.95:54136 > 10.0.0.1:49152 S
[ALERT] SYN Packet detected from 10.0.0.95 to 10.0.0.1 at 2024-11-25 21:53:48
Packet Data: Ether / IP / TCP 10.0.0.95:54137 > 10.0.0.1:49152 S
[ALERT] SYN Packet detected from 10.0.0.95 to 10.0.0.1 at 2024-11-25 21:53:48
Packet Data: Ether / IP / TCP 10.0.0.95:54138 > 10.0.0.1:49152 S
[ALERT] SYN Packet detected from 10.0.0.95 to 10.0.0.1 at 2024-11-25 21:53:49
Packet Data: Ether / IP / TCP 10.0.0.95:54139 > 10.0.0.1:49152 S
[ALERT] SYN Packet detected from 10.0.0.95 to 10.0.0.1 at 2024-11-25 21:53:49
Packet Data: Ether / IP / TCP 10.0.0.95:54140 > 10.0.0.1:49152 S
[ALERT] SYN Packet detected from 10.0.0.95 to 10.0.0.1 at 2024-11-25 21:53:49
Packet Data: Ether / IP / TCP 10.0.0.95:54141 > 10.0.0.1:49152 S
[ALERT] SYN Packet detected from 10.0.0.95 to 10.0.0.1 at 2024-11-25 21:53:49
Packet Data: Ether / IP / TCP 10.0.0.95:54142 > 10.0.0.1:49152 S
[ALERT] SYN Packet detected from 10.0.0.95 to 10.0.0.1 at 2024-11-25 21:53:50
Packet Data: Ether / IP / TCP 10.0.0.95:54143 > 10.0.0.1:49152 S
[ALERT] SYN Packet detected from 10.0.0.95 to 10.0.0.1 at 2024-11-25 21:53:50
Packet Data: Ether / IP / TCP 10.0.0.95:54144 > 10.0.0.1:49152 S
[ALERT] SYN Packet detected from 10.0.0.95 to 10.0.0.1 at 2024-11-25 21:53:50
Packet Data: Ether / IP / TCP 10.0.0.95:54145 > 10.0.0.1:49152 S
[ALERT] SYN Packet detected from 10.0.0.95 to 10.0.0.1 at 2024-11-25 21:53:50
Packet Data: Ether / IP / TCP 10.0.0.95:54146 > 10.0.0.1:49152 S
[ALERT] SYN Packet detected from 10.0.0.95 to 10.0.0.1 at 2024-11-25 21:53:51
Packet Data: Ether / IP / TCP 10.0.0.95:54147 > 10.0.0.1:49152 S
[ALERT] SYN Packet detected from 10.0.0.95 to 10.0.0.1 at 2024-11-25 21:53:51
Packet Data: Ether / IP / TCP 10.0.0.95:54148 > 10.0.0.1:49152 S
[ALERT] SYN Packet detected from 10.0.0.95 to 10.0.0.1 at 2024-11-25 21:53:51
Packet Data: Ether / IP / TCP 10.0.0.95:54149 > 10.0.0.1:49152 S
[ALERT] SYN Packet detected from 10.0.0.95 to 10.0.0.1 at 2024-11-25 21:53:51
Packet Data: Ether / IP / TCP 10.0.0.95:54150 > 10.0.0.1:49152 S
[ALERT] SYN Packet detected from 10.0.0.95 to 10.0.0.1 at 2024-11-25 21:53:52
Packet Data: Ether / IP / TCP 10.0.0.95:54151 > 10.0.0.1:49152 S
[ALERT] SYN Packet detected from 10.0.0.95 to 10.0.0.1 at 2024-11-25 21:53:52
Packet Data: Ether / IP / TCP 10.0.0.95:54152 > 10.0.0.1:49152 S
[ALERT] SYN Packet detected from 10.0.0.95 to 10.0.0.1 at 2024-11-25 21:53:52
Packet Data: Ether / IP / TCP 10.0.0.95:54153 > 10.0.0.1:49152 S
[ALERT] SYN Packet detected from 10.0.0.95 to 10.0.0.1 at 2024-11-25 21:53:52
Packet Data: Ether / IP / TCP 10.0.0.95:54154 > 10.0.0.1:49152 S
[ALERT] SYN Packet detected from 10.0.0.95 to 10.0.0.1 at 2024-11-25 21:53:53
Packet Data: Ether / IP / TCP 10.0.0.95:54155 > 10.0.0.1:49152 S
[ALERT] SYN Packet detected from 10.0.0.95 to 10.0.0.1 at 2024-11-25 21:53:53
Packet Data: Ether / IP / TCP 10.0.0.95:54156 > 10.0.0.1:49152 S
[ALERT] SYN Packet detected from 10.0.0.95 to 10.0.0.1 at 2024-11-25 21:53:53
Packet Data: Ether / IP / TCP 10.0.0.95:54157 > 10.0.0.1:49152 S
[ALERT] SYN Packet detected from 10.0.0.95 to 10.0.0.1 at 2024-11-25 21:53:53
Packet Data: Ether / IP / TCP 10.0.0.95:54158 > 10.0.0.1:49152 S
[ALERT] SYN Packet detected from 10.0.0.95 to 10.0.0.1 at 2024-11-25 21:53:53
Packet Data: Ether / IP / TCP 10.0.0.95:54159 > 10.0.0.1:49152 S
[ALERT] SYN Packet detected from 10.0.0.95 to 10.0.0.1 at 2024-11-25 21:53:53
Packet Data: Ether / IP / TCP 10.0.0.95:54160 > 10.0.0.1:49152 S
[ALERT] SYN Packet detected from 10.0.0.95 to 10.0.0.1 at 2024-11-25 21:53:53
Packet Data: Ether / IP / TCP 10.0.0.95:54161 > 10.0.0.1:49152 S
[ALERT] SYN Packet detected from 10.0.0.95 to 10.0.0.1 at 2024-11-25 21:53:53
Packet Data: Ether / IP / TCP 10.0.0.95:54162 > 10.0.0.1:49152 S
[ALERT] SYN Packet detected from 10.0.0.95 to 10.0.0.1 at 2024-11-25 21:53:54
Packet Data: Ether / IP / TCP 10.0.0.95:54163 > 10.0.0.1:49152 S
[ALERT] SYN Packet detected from 10.0.0.95 to 10.0.0.1 at 2024-11-25 21:53:54
Packet Data: Ether / IP / TCP 10.0.0.95:54164 > 10.0.0.1:49152 S
[ALERT] SYN Packet detected from 10.0.0.95 to 10.0.0.1 at 2024-11-25 21:53:54
Packet Data: Ether / IP / TCP 10.0.0.95:54165 > 10.0.0.1:49152 S
[ALERT] SYN Packet detected from 10.0.0.95 to 10.0.0.1 at 2024-11-25 21:53:54
Packet Data: Ether / IP / TCP 10.0.0.95:54166 > 10.0.0.1:49152 S
[ALERT] SYN Packet detected from 10.0.0.95 to 10.0.0.1 at 2024-11-25 21:53:55
Packet Data: Ether / IP / TCP 10.0.0.95:54167 > 10.0.0.1:49152 S
[ALERT] SYN Packet detected from 10.0.0.95 to 10.0.0.1 at 2024-11-25 21:53:55
Packet Data: Ether / IP / TCP 10.0.0.95:54168 > 10.0.0.1:49152 S
[ALERT] SYN Packet detected from 10.0.0.95 to 10.0.0.1 at 2024-11-25 21:53:55
Packet Data: Ether / IP / TCP 10.0.0.95:54169 > 10.0.0.1:49152 S
[ALERT] SYN Packet detected from 10.0.0.95 to 10.0.0.1 at 2024-11-25 21:53:55
Packet Data: Ether / IP / TCP 10.0.0.95:54170 > 10.0.0.1:49152 S
[ALERT] SYN Packet detected from 10.0.0.95 to 10.0.0.1 at 2024-11-25 21:53:55
Packet Data: Ether / IP / TCP 10.0.0.95:54171 > 10.0.0.1:49152 S
[ALERT] SYN Packet detected from 10.0.0.95 to 10.0.0.1 at 2024-11-25 21:53:55
Packet Data: Ether / IP / TCP 10.0.0.95:54172 > 10.0.0.1:49152 S
[ALERT] SYN Packet detected from 10.0.0.95 to 10.0.0.1 at 2024-11-25 21:53:55
Packet Data: Ether / IP / TCP 10.0.0.95:54173 > 10.0.0.1:49152 S
[ALERT] SYN Packet detected from 10.0.0.95 to 10.0.0.1 at 2024-11-25 21:53:55
Packet Data: Ether / IP / TCP 10.0.0.95:54174 > 10.0.0.1:49152 S
[ALERT] SYN Packet detected from 10.0.0.95 to 10.0.0.1 at 2024-11-25 21:53:56
Packet Data: Ether / IP / TCP 10.0.0.95:54175 > 10.0.0.1:49152 S
[ALERT] SYN Packet detected from 10.0.0.95 to 10.0.0.1 at 2024-11-25 21:53:56
Packet Data: Ether / IP / TCP 10.0.0.95:54176 > 10.0.0.1:49152 S
[ALERT] SYN Packet detected from 10.0.0.95 to 10.0.0.1 at 2024-11-25 21:53:56
Packet Data: Ether / IP / TCP 10.0.0.95:54177 > 10.0.0.1:49152 S
[ALERT] SYN Packet detected from 10.0.0.95 to 10.0.0.1 at 2024-11-25 21:53:56
Packet Data: Ether / IP / TCP 10.0.0.95:54178 > 10.0.0.1:49152 S
[ALERT] SYN Packet detected from 10.0.0.95 to 10.0.0.1 at 2024-11-25 21:53:56
Packet Data: Ether / IP / TCP 10.0.0.95:54179 > 10.0.0.1:49152 S
[ALERT] SYN Packet detected from 10.0.0.95 to 10.0.0.1 at 2024-11-25 21:53:56
Packet Data: Ether / IP / TCP 10.0.0.95:54180 > 10.0.0.1:49152 S
[ALERT] SYN Packet detected from 10.0.0.95 to 10.0.0.1 at 2024-11-25 21:53:56
Packet Data: Ether / IP / TCP 10.0.0.95:54181 > 10.0.0.1:49152 S
[ALERT] SYN Packet detected from 10.0.0.95 to 10.0.0.1 at 2024-11-25 21:53:56
Packet Data: Ether / IP / TCP 10.0.0.95:54182 > 10.0.0.1:49152 S
[ALERT] SYN Packet detected from 10.0.0.95 to 10.0.0.1 at 2024-11-25 21:53:57
Packet Data: Ether / IP / TCP 10.0.0.95:54183 > 10.0.0.1:49152 S
[ALERT] SYN Packet detected from 10.0.0.95 to 10.0.0.1 at 2024-11-25 21:53:57
Packet Data: Ether / IP / TCP 10.0.0.95:54184 > 10.0.0.1:49152 S
[ALERT] SYN Packet detected from 10.0.0.95 to 10.0.0.1 at 2024-11-25 21:53:57
Packet Data: Ether / IP / TCP 10.0.0.95:54185 > 10.0.0.1:49152 S
[ALERT] SYN Packet detected from 10.0.0.95 to 10.0.0.1 at 2024-11-25 21:53:57
Packet Data: Ether / IP / TCP 10.0.0.95:54186 > 10.0.0.1:49152 S
[ALERT] SYN Packet detected from 10.0.0.95 to 10.0.0.1 at 2024-11-25 21:53:57
Packet Data: Ether / IP / TCP 10.0.0.95:54187 > 10.0.0.1:49152 S
[ALERT] SYN Packet detected from 10.0.0.95 to 10.0.0.1 at 2024-11-25 21:53:57
Packet Data: Ether / IP / TCP 10.0.0.95:54188 > 10.0.0.1:49152 S
[ALERT] SYN Packet detected from 10.0.0.95 to 10.0.0.1 at 2024-11-25 21:53:57
Packet Data: Ether / IP / TCP 10.0.0.95:54189 > 10.0.0.1:49152 S
[ALERT] SYN Packet detected from 10.0.0.95 to 10.0.0.1 at 2024-11-25 21:53:57
Packet Data: Ether / IP / TCP 10.0.0.95:54190 > 10.0.0.1:49152 S
[ALERT] SYN Packet detected from 10.0.0.95 to 10.0.0.1 at 2024-11-25 21:53:58
Packet Data: Ether / IP / TCP 10.0.0.95:54191 > 10.0.0.1:49152 S
[ALERT] SYN Packet detected from 10.0.0.95 to 10.0.0.1 at 2024-11-25 21:53:58
Packet Data: Ether / IP / TCP 10.0.0.95:54192 > 10.0.0.1:49152 S
[ALERT] SYN Packet detected from 10.0.0.95 to 10.0.0.1 at 2024-11-25 21:53:58
Packet Data: Ether / IP / TCP 10.0.0.95:54193 > 10.0.0.1:49152 S
[ALERT] SYN Packet detected from 10.0.0.95 to 10.0.0.1 at 2024-11-25 21:53:58
Packet Data: Ether / IP / TCP 10.0.0.95:54194 > 10.0.0.1:49152 S
[ALERT] SYN Packet detected from 10.0.0.95 to 10.0.0.1 at 2024-11-25 21:53:58
Packet Data: Ether / IP / TCP 10.0.0.95:54195 > 10.0.0.1:49152 S
[ALERT] SYN Packet detected from 10.0.0.95 to 10.0.0.1 at 2024-11-25 21:53:58
Packet Data: Ether / IP / TCP 10.0.0.95:54196 > 10.0.0.1:49152 S
[ALERT] SYN Packet detected from 10.0.0.95 to 10.0.0.1 at 2024-11-25 21:53:58
Packet Data: Ether / IP / TCP 10.0.0.95:54197 > 10.0.0.1:49152 S
[ALERT] SYN Packet detected from 10.0.0.95 to 10.0.0.1 at 2024-11-25 21:53:58
Packet Data: Ether / IP / TCP 10.0.0.95:54198 > 10.0.0.1:49152 S
[ALERT] SYN Packet detected from 10.0.0.95 to 10.0.0.1 at 2024-11-25 21:53:59
Packet Data: Ether / IP / TCP 10.0.0.95:54199 > 10.0.0.1:49152 S
[ALERT] SYN Packet detected from 10.0.0.95 to 10.0.0.1 at 2024-11-25 21:53:59
Packet Data: Ether / IP / TCP 10.0.0.95:54200 > 10.0.0.1:49152 S
[ALERT] SYN Packet detected from 10.0.0.95 to 10.0.0.1 at 2024-11-25 21:53:59
Packet Data: Ether / IP / TCP 10.0.0.95:54201 > 10.0.0.1:49152 S
[ALERT] SYN Packet detected from 10.0.0.95 to 10.0.0.1 at 2024-11-25 21:53:59
Packet Data: Ether / IP / TCP 10.0.0.95:54202 > 10.0.0.1:49152 S
[ALERT] SYN Packet detected from 10.0.0.95 to 10.0.0.1 at 2024-11-25 21:53:59
Packet Data: Ether / IP / TCP 10.0.0.95:54203 > 10.0.0.1:49152 S
[ALERT] SYN Packet detected from 10.0.0.95 to 10.0.0.1 at 2024-11-25 21:53:59
Packet Data: Ether / IP / TCP 10.0.0.95:54204 > 10.0.0.1:49152 S
[ALERT] SYN Packet detected from 10.0.0.95 to 10.0.0.1 at 2024-11-25 21:53:59
Packet Data: Ether / IP / TCP 10.0.0.95:54205 > 10.0.0.1:49152 S
[ALERT] SYN Packet detected from 10.0.0.95 to 10.0.0.1 at 2024-11-25 21:53:59
Packet Data: Ether / IP / TCP 10.0.0.95:54206 > 10.0.0.1:49152 S
[ALERT] SYN Packet detected from 10.0.0.95 to 10.0.0.1 at 2024-11-25 21:54:00
Packet Data: Ether / IP / TCP 10.0.0.95:54207 > 10.0.0.1:49152 S
[ALERT] SYN Packet detected from 10.0.0.95 to 10.0.0.1 at 2024-11-25 21:54:00
Packet Data: Ether / IP / TCP 10.0.0.95:54208 > 10.0.0.1:49152 S
[ALERT] SYN Packet detected from 10.0.0.95 to 10.0.0.1 at 2024-11-25 21:54:00
Packet Data: Ether / IP / TCP 10.0.0.95:54209 > 10.0.0.1:49152 S
[ALERT] SYN Packet detected from 10.0.0.95 to 10.0.0.1 at 2024-11-25 21:54:00
Packet Data: Ether / IP / TCP 10.0.0.95:54210 > 10.0.0.1:49152 S
[ALERT] SYN Packet detected from 10.0.0.95 to 10.0.0.1 at 2024-11-25 21:54:01
Packet Data: Ether / IP / TCP 10.0.0.95:54211 > 10.0.0.1:49152 S
[ALERT] SYN Packet detected from 10.0.0.95 to 10.0.0.1 at 2024-11-25 21:54:01
Packet Data: Ether / IP / TCP 10.0.0.95:54212 > 10.0.0.1:49152 S
[ALERT] SYN Packet detected from 10.0.0.95 to 10.0.0.1 at 2024-11-25 21:54:02
Packet Data: Ether / IP / TCP 10.0.0.95:54213 > 10.0.0.1:49152 S
[ALERT] SYN Packet detected from 10.0.0.95 to 10.0.0.1 at 2024-11-25 21:54:02
Packet Data: Ether / IP / TCP 10.0.0.95:54214 > 10.0.0.1:49152 S
[ALERT] SYN Packet detected from 10.0.0.95 to 10.0.0.1 at 2024-11-25 21:54:02
Packet Data: Ether / IP / TCP 10.0.0.95:54215 > 10.0.0.1:49152 S
[ALERT] SYN Packet detected from 10.0.0.95 to 10.0.0.1 at 2024-11-25 21:54:02
Packet Data: Ether / IP / TCP 10.0.0.95:54216 > 10.0.0.1:49152 S
[ALERT] SYN Packet detected from 10.0.0.95 to 10.0.0.1 at 2024-11-25 21:54:02
Packet Data: Ether / IP / TCP 10.0.0.95:54217 > 10.0.0.1:49152 S
[ALERT] SYN Packet detected from 10.0.0.95 to 10.0.0.1 at 2024-11-25 21:54:02
Packet Data: Ether / IP / TCP 10.0.0.95:54218 > 10.0.0.1:49152 S
[ALERT] SYN Packet detected from 10.0.0.95 to 10.0.0.1 at 2024-11-25 21:54:03
Packet Data: Ether / IP / TCP 10.0.0.95:54219 > 10.0.0.1:49152 S
[ALERT] SYN Packet detected from 10.0.0.95 to 10.0.0.1 at 2024-11-25 21:54:03
Packet Data: Ether / IP / TCP 10.0.0.95:54220 > 10.0.0.1:49152 S
[ALERT] SYN Packet detected from 10.0.0.95 to 10.0.0.1 at 2024-11-25 21:54:03
Packet Data: Ether / IP / TCP 10.0.0.95:54221 > 10.0.0.1:49152 S
[ALERT] SYN Packet detected from 10.0.0.95 to 10.0.0.1 at 2024-11-25 21:54:03
Packet Data: Ether / IP / TCP 10.0.0.95:54222 > 10.0.0.1:49152 S
[ALERT] SYN Packet detected from 10.0.0.95 to 10.0.0.1 at 2024-11-25 21:54:03
Packet Data: Ether / IP / TCP 10.0.0.95:54223 > 10.0.0.1:49152 S
[ALERT] SYN Packet detected from 10.0.0.95 to 10.0.0.1 at 2024-11-25 21:54:03
Packet Data: Ether / IP / TCP 10.0.0.95:54224 > 10.0.0.1:49152 S
[ALERT] SYN Packet detected from 10.0.0.95 to 10.0.0.1 at 2024-11-25 21:54:03
Packet Data: Ether / IP / TCP 10.0.0.95:54225 > 10.0.0.1:49152 S
[ALERT] SYN Packet detected from 10.0.0.95 to 10.0.0.1 at 2024-11-25 21:54:03
Packet Data: Ether / IP / TCP 10.0.0.95:54226 > 10.0.0.1:49152 S
[ALERT] SYN Packet detected from 10.0.0.95 to 10.0.0.1 at 2024-11-25 21:54:04
Packet Data: Ether / IP / TCP 10.0.0.95:54227 > 10.0.0.1:49152 S
[ALERT] SYN Packet detected from 10.0.0.95 to 10.0.0.1 at 2024-11-25 21:54:04
Packet Data: Ether / IP / TCP 10.0.0.95:54228 > 10.0.0.1:49152 S
[ALERT] SYN Packet detected from 10.0.0.95 to 10.0.0.1 at 2024-11-25 21:54:04
Packet Data: Ether / IP / TCP 10.0.0.95:54229 > 10.0.0.1:49152 S
[ALERT] SYN Packet detected from 10.0.0.95 to 10.0.0.1 at 2024-11-25 21:54:04
Packet Data: Ether / IP / TCP 10.0.0.95:54230 > 10.0.0.1:49152 S
[ALERT] SYN Packet detected from 10.0.0.95 to 10.0.0.1 at 2024-11-25 21:54:05
Packet Data: Ether / IP / TCP 10.0.0.95:54231 > 10.0.0.1:49152 S
[ALERT] SYN Packet detected from 10.0.0.95 to 10.0.0.1 at 2024-11-25 21:54:05
Packet Data: Ether / IP / TCP 10.0.0.95:54232 > 10.0.0.1:49152 S
[ALERT] SYN Packet detected from 10.0.0.95 to 10.0.0.1 at 2024-11-25 21:54:05
Packet Data: Ether / IP / TCP 10.0.0.95:54233 > 10.0.0.1:49152 S
[ALERT] SYN Packet detected from 10.0.0.95 to 10.0.0.1 at 2024-11-25 21:54:05
Packet Data: Ether / IP / TCP 10.0.0.95:54234 > 10.0.0.1:49152 S
[ALERT] SYN Packet detected from 10.0.0.95 to 10.0.0.1 at 2024-11-25 21:54:05
Packet Data: Ether / IP / TCP 10.0.0.95:54235 > 10.0.0.1:49152 S
[ALERT] SYN Packet detected from 10.0.0.95 to 10.0.0.1 at 2024-11-25 21:54:05
Packet Data: Ether / IP / TCP 10.0.0.95:54236 > 10.0.0.1:49152 S
[ALERT] SYN Packet detected from 10.0.0.95 to 10.0.0.1 at 2024-11-25 21:54:05
Packet Data: Ether / IP / TCP 10.0.0.95:54237 > 10.0.0.1:49152 S
[ALERT] SYN Packet detected from 10.0.0.95 to 10.0.0.1 at 2024-11-25 21:54:05
Packet Data: Ether / IP / TCP 10.0.0.95:54238 > 10.0.0.1:49152 S
[ALERT] SYN Packet detected from 10.0.0.95 to 52.1.113.157 at 2024-11-25 21:54:05
Packet Data: Ether / IP / TCP 10.0.0.95:54239 > 52.1.113.157:https S
[ALERT] SYN Packet detected from 10.0.0.95 to 10.0.0.1 at 2024-11-25 21:54:06
Packet Data: Ether / IP / TCP 10.0.0.95:54240 > 10.0.0.1:49152 S
[ALERT] SYN Packet detected from 10.0.0.95 to 10.0.0.1 at 2024-11-25 21:54:06
Packet Data: Ether / IP / TCP 10.0.0.95:54241 > 10.0.0.1:49152 S
[ALERT] SYN Packet detected from 10.0.0.95 to 10.0.0.1 at 2024-11-25 21:54:06
Packet Data: Ether / IP / TCP 10.0.0.95:54242 > 10.0.0.1:49152 S
[ALERT] SYN Packet detected from 10.0.0.95 to 10.0.0.1 at 2024-11-25 21:54:06
Packet Data: Ether / IP / TCP 10.0.0.95:54243 > 10.0.0.1:49152 S
[ALERT] SYN Packet detected from 10.0.0.95 to 10.0.0.1 at 2024-11-25 21:54:06
Packet Data: Ether / IP / TCP 10.0.0.95:54244 > 10.0.0.1:49152 S
[ALERT] SYN Packet detected from 10.0.0.95 to 10.0.0.1 at 2024-11-25 21:54:06
Packet Data: Ether / IP / TCP 10.0.0.95:54245 > 10.0.0.1:49152 S
[ALERT] SYN Packet detected from 10.0.0.95 to 10.0.0.1 at 2024-11-25 21:54:06
Packet Data: Ether / IP / TCP 10.0.0.95:54246 > 10.0.0.1:49152 S
[ALERT] SYN Packet detected from 10.0.0.95 to 10.0.0.1 at 2024-11-25 21:54:06
Packet Data: Ether / IP / TCP 10.0.0.95:54247 > 10.0.0.1:49152 S
[ALERT] SYN Packet detected from 10.0.0.95 to 10.0.0.1 at 2024-11-25 21:54:07
Packet Data: Ether / IP / TCP 10.0.0.95:54248 > 10.0.0.1:49152 S
[ALERT] SYN Packet detected from 10.0.0.95 to 10.0.0.1 at 2024-11-25 21:54:07
Packet Data: Ether / IP / TCP 10.0.0.95:54249 > 10.0.0.1:49152 S
[ALERT] SYN Packet detected from 10.0.0.95 to 10.0.0.1 at 2024-11-25 21:54:07
Packet Data: Ether / IP / TCP 10.0.0.95:54250 > 10.0.0.1:49152 S
[ALERT] SYN Packet detected from 10.0.0.95 to 10.0.0.1 at 2024-11-25 21:54:07
Packet Data: Ether / IP / TCP 10.0.0.95:54251 > 10.0.0.1:49152 S
[ALERT] SYN Packet detected from 10.0.0.95 to 10.0.0.1 at 2024-11-25 21:54:07
Packet Data: Ether / IP / TCP 10.0.0.95:54252 > 10.0.0.1:49152 S
[ALERT] SYN Packet detected from 10.0.0.95 to 10.0.0.1 at 2024-11-25 21:54:07
Packet Data: Ether / IP / TCP 10.0.0.95:54253 > 10.0.0.1:49152 S
[ALERT] SYN Packet detected from 10.0.0.95 to 10.0.0.1 at 2024-11-25 21:54:07
Packet Data: Ether / IP / TCP 10.0.0.95:54254 > 10.0.0.1:49152 S
[ALERT] SYN Packet detected from 10.0.0.95 to 10.0.0.1 at 2024-11-25 21:54:07
Packet Data: Ether / IP / TCP 10.0.0.95:54255 > 10.0.0.1:49152 S
[ALERT] SYN Packet detected from 10.0.0.95 to 10.0.0.1 at 2024-11-25 21:54:08
Packet Data: Ether / IP / TCP 10.0.0.95:54256 > 10.0.0.1:49152 S
[ALERT] SYN Packet detected from 10.0.0.95 to 10.0.0.1 at 2024-11-25 21:54:08
Packet Data: Ether / IP / TCP 10.0.0.95:54257 > 10.0.0.1:49152 S
[ALERT] SYN Packet detected from 10.0.0.95 to 10.0.0.1 at 2024-11-25 21:54:08
Packet Data: Ether / IP / TCP 10.0.0.95:54258 > 10.0.0.1:49152 S
[ALERT] SYN Packet detected from 10.0.0.95 to 10.0.0.1 at 2024-11-25 21:54:08
Packet Data: Ether / IP / TCP 10.0.0.95:54259 > 10.0.0.1:49152 S
[ALERT] SYN Packet detected from 10.0.0.95 to 10.0.0.1 at 2024-11-25 21:54:08
Packet Data: Ether / IP / TCP 10.0.0.95:54260 > 10.0.0.1:49152 S
[ALERT] SYN Packet detected from 10.0.0.95 to 10.0.0.1 at 2024-11-25 21:54:08
Packet Data: Ether / IP / TCP 10.0.0.95:54261 > 10.0.0.1:49152 S
[ALERT] SYN Packet detected from 10.0.0.95 to 10.0.0.1 at 2024-11-25 21:54:08
Packet Data: Ether / IP / TCP 10.0.0.95:54262 > 10.0.0.1:49152 S
[ALERT] SYN Packet detected from 10.0.0.95 to 10.0.0.1 at 2024-11-25 21:54:08
Packet Data: Ether / IP / TCP 10.0.0.95:54263 > 10.0.0.1:49152 S
[ALERT] SYN Packet detected from 10.0.0.95 to 10.0.0.1 at 2024-11-25 21:54:09
Packet Data: Ether / IP / TCP 10.0.0.95:54264 > 10.0.0.1:49152 S
[ALERT] SYN Packet detected from 10.0.0.95 to 10.0.0.1 at 2024-11-25 21:54:09
Packet Data: Ether / IP / TCP 10.0.0.95:54265 > 10.0.0.1:49152 S
[ALERT] SYN Packet detected from 10.0.0.95 to 10.0.0.1 at 2024-11-25 21:54:09
Packet Data: Ether / IP / TCP 10.0.0.95:54266 > 10.0.0.1:49152 S
[ALERT] SYN Packet detected from 10.0.0.95 to 10.0.0.1 at 2024-11-25 21:54:09
Packet Data: Ether / IP / TCP 10.0.0.95:54267 > 10.0.0.1:49152 S
[ALERT] SYN Packet detected from 10.0.0.95 to 10.0.0.1 at 2024-11-25 21:54:09
Packet Data: Ether / IP / TCP 10.0.0.95:54268 > 10.0.0.1:49152 S
[ALERT] SYN Packet detected from 10.0.0.95 to 10.0.0.1 at 2024-11-25 21:54:09
Packet Data: Ether / IP / TCP 10.0.0.95:54269 > 10.0.0.1:49152 S
[ALERT] SYN Packet detected from 10.0.0.95 to 10.0.0.1 at 2024-11-25 21:54:09
Packet Data: Ether / IP / TCP 10.0.0.95:54270 > 10.0.0.1:49152 S
[ALERT] SYN Packet detected from 10.0.0.95 to 10.0.0.1 at 2024-11-25 21:54:09
Packet Data: Ether / IP / TCP 10.0.0.95:54271 > 10.0.0.1:49152 S
[ALERT] SYN Packet detected from 10.0.0.95 to 10.0.0.1 at 2024-11-25 21:54:09
Packet Data: Ether / IP / TCP 10.0.0.95:54272 > 10.0.0.1:49152 S
[ALERT] SYN Packet detected from 10.0.0.95 to 10.0.0.1 at 2024-11-25 21:54:09
Packet Data: Ether / IP / TCP 10.0.0.95:54273 > 10.0.0.1:49152 S
[ALERT] SYN Packet detected from 10.0.0.95 to 10.0.0.1 at 2024-11-25 21:54:52
Packet Data: Ether / IP / TCP 10.0.0.95:54277 > 10.0.0.1:49152 S
[ALERT] SYN Packet detected from 10.0.0.95 to 10.0.0.1 at 2024-11-25 21:54:52
Packet Data: Ether / IP / TCP 10.0.0.95:54278 > 10.0.0.1:49152 S
[ALERT] SYN Packet detected from 10.0.0.1 to 10.0.0.95 at 2024-11-25 21:54:52
Packet Data: Ether / IP / TCP 10.0.0.1:47008 > 10.0.0.95:icslap S
[ALERT] SYN Packet detected from 10.0.0.95 to 10.0.0.1 at 2024-11-25 21:54:52
Packet Data: Ether / IP / TCP 10.0.0.95:54279 > 10.0.0.1:49152 S
[ALERT] SYN Packet detected from 10.0.0.95 to 10.0.0.1 at 2024-11-25 21:54:52
Packet Data: Ether / IP / TCP 10.0.0.95:54280 > 10.0.0.1:49152 S
[ALERT] SYN Packet detected from 10.0.0.95 to 10.0.0.1 at 2024-11-25 21:54:52
Packet Data: Ether / IP / TCP 10.0.0.95:54281 > 10.0.0.1:49152 S
[ALERT] SYN Packet detected from 10.0.0.95 to 10.0.0.1 at 2024-11-25 21:54:52
Packet Data: Ether / IP / TCP 10.0.0.95:54282 > 10.0.0.1:49152 S
[ALERT] SYN Packet detected from 10.0.0.1 to 10.0.0.95 at 2024-11-25 21:54:52
Packet Data: Ether / IP / TCP 10.0.0.1:47012 > 10.0.0.95:icslap S
[ALERT] SYN Packet detected from 10.0.0.95 to 10.0.0.1 at 2024-11-25 21:54:52
Packet Data: Ether / IP / TCP 10.0.0.95:54283 > 10.0.0.1:49152 S
[ALERT] SYN Packet detected from 10.0.0.95 to 10.0.0.1 at 2024-11-25 21:54:52
Packet Data: Ether / IP / TCP 10.0.0.95:54284 > 10.0.0.1:49152 S
[ALERT] SYN Packet detected from 10.0.0.95 to 10.0.0.1 at 2024-11-25 21:54:52
Packet Data: Ether / IP / TCP 10.0.0.95:54285 > 10.0.0.1:49152 S
[ALERT] SYN Packet detected from 10.0.0.95 to 10.0.0.1 at 2024-11-25 21:54:52
Packet Data: Ether / IP / TCP 10.0.0.95:54286 > 10.0.0.1:49152 S
[ALERT] SYN Packet detected from 10.0.0.95 to 10.0.0.1 at 2024-11-25 21:54:52
Packet Data: Ether / IP / TCP 10.0.0.95:54287 > 10.0.0.1:49152 S
[ALERT] SYN Packet detected from 10.0.0.95 to 10.0.0.1 at 2024-11-25 21:54:52
Packet Data: Ether / IP / TCP 10.0.0.95:54288 > 10.0.0.1:49152 S
[ALERT] SYN Packet detected from 10.0.0.95 to 10.0.0.1 at 2024-11-25 21:54:52
Packet Data: Ether / IP / TCP 10.0.0.95:54289 > 10.0.0.1:49152 S
[ALERT] SYN Packet detected from 10.0.0.95 to 10.0.0.1 at 2024-11-25 21:54:52
Packet Data: Ether / IP / TCP 10.0.0.95:54290 > 10.0.0.1:49152 S
[ALERT] SYN Packet detected from 10.0.0.95 to 10.0.0.1 at 2024-11-25 21:54:52
Packet Data: Ether / IP / TCP 10.0.0.95:54291 > 10.0.0.1:49152 S
[ALERT] SYN Packet detected from 10.0.0.95 to 10.0.0.1 at 2024-11-25 21:54:52
Packet Data: Ether / IP / TCP 10.0.0.95:54292 > 10.0.0.1:49152 S
[ALERT] SYN Packet detected from 10.0.0.95 to 10.0.0.1 at 2024-11-25 21:54:52
Packet Data: Ether / IP / TCP 10.0.0.95:54293 > 10.0.0.1:49152 S
[ALERT] SYN Packet detected from 10.0.0.95 to 10.0.0.1 at 2024-11-25 21:54:52
Packet Data: Ether / IP / TCP 10.0.0.95:54294 > 10.0.0.1:49152 S
[ALERT] SYN Packet detected from 10.0.0.95 to 10.0.0.1 at 2024-11-25 21:54:52
Packet Data: Ether / IP / TCP 10.0.0.95:54295 > 10.0.0.1:49152 S
[ALERT] SYN Packet detected from 10.0.0.95 to 10.0.0.1 at 2024-11-25 21:54:53
Packet Data: Ether / IP / TCP 10.0.0.95:54296 > 10.0.0.1:49152 S
[ALERT] SYN Packet detected from 10.0.0.1 to 10.0.0.95 at 2024-11-25 21:54:53
Packet Data: Ether / IP / TCP 10.0.0.1:47008 > 10.0.0.95:icslap S
[ALERT] SYN Packet detected from 10.0.0.1 to 10.0.0.95 at 2024-11-25 21:54:53
Packet Data: Ether / IP / TCP 10.0.0.1:47012 > 10.0.0.95:icslap S
[ALERT] SYN Packet detected from 10.0.0.1 to 10.0.0.95 at 2024-11-25 21:54:55
Packet Data: Ether / IP / TCP 10.0.0.1:47008 > 10.0.0.95:icslap S
[ALERT] SYN Packet detected from 10.0.0.1 to 10.0.0.95 at 2024-11-25 21:54:55
Packet Data: Ether / IP / TCP 10.0.0.1:47012 > 10.0.0.95:icslap S
[ALERT] SYN Packet detected from 10.0.0.95 to 10.0.0.1 at 2024-11-25 21:54:56
Packet Data: Ether / IP / TCP 10.0.0.95:54297 > 10.0.0.1:49152 S
[ALERT] SYN Packet detected from 10.0.0.95 to 10.0.0.1 at 2024-11-25 21:54:56
Packet Data: Ether / IP / TCP 10.0.0.95:54298 > 10.0.0.1:49152 S
[ALERT] SYN Packet detected from 10.0.0.1 to 10.0.0.95 at 2024-11-25 21:54:56
Packet Data: Ether / IP / TCP 10.0.0.1:47026 > 10.0.0.95:icslap S
[ALERT] SYN Packet detected from 10.0.0.95 to 10.0.0.1 at 2024-11-25 21:54:56
Packet Data: Ether / IP / TCP 10.0.0.95:54299 > 10.0.0.1:49152 S
[ALERT] SYN Packet detected from 10.0.0.95 to 10.0.0.1 at 2024-11-25 21:54:56
Packet Data: Ether / IP / TCP 10.0.0.95:54300 > 10.0.0.1:49152 S
[ALERT] SYN Packet detected from 10.0.0.95 to 10.0.0.1 at 2024-11-25 21:54:56
Packet Data: Ether / IP / TCP 10.0.0.95:54301 > 10.0.0.1:49152 S
[ALERT] SYN Packet detected from 10.0.0.95 to 10.0.0.1 at 2024-11-25 21:54:56
Packet Data: Ether / IP / TCP 10.0.0.95:54302 > 10.0.0.1:49152 S
[ALERT] SYN Packet detected from 10.0.0.1 to 10.0.0.95 at 2024-11-25 21:54:56
Packet Data: Ether / IP / TCP 10.0.0.1:47028 > 10.0.0.95:icslap S
[ALERT] SYN Packet detected from 10.0.0.95 to 10.0.0.1 at 2024-11-25 21:54:56
Packet Data: Ether / IP / TCP 10.0.0.95:54303 > 10.0.0.1:49152 S
[ALERT] SYN Packet detected from 10.0.0.95 to 10.0.0.1 at 2024-11-25 21:54:56
Packet Data: Ether / IP / TCP 10.0.0.95:54304 > 10.0.0.1:49152 S
[ALERT] SYN Packet detected from 10.0.0.95 to 10.0.0.1 at 2024-11-25 21:54:56
Packet Data: Ether / IP / TCP 10.0.0.95:54305 > 10.0.0.1:49152 S
[ALERT] SYN Packet detected from 10.0.0.95 to 10.0.0.1 at 2024-11-25 21:54:56
Packet Data: Ether / IP / TCP 10.0.0.95:54306 > 10.0.0.1:49152 S
[ALERT] SYN Packet detected from 10.0.0.95 to 10.0.0.1 at 2024-11-25 21:54:56
Packet Data: Ether / IP / TCP 10.0.0.95:54307 > 10.0.0.1:49152 S
[ALERT] SYN Packet detected from 10.0.0.95 to 10.0.0.1 at 2024-11-25 21:54:56
Packet Data: Ether / IP / TCP 10.0.0.95:54308 > 10.0.0.1:49152 S
[ALERT] SYN Packet detected from 10.0.0.95 to 10.0.0.1 at 2024-11-25 21:54:56
Packet Data: Ether / IP / TCP 10.0.0.95:54309 > 10.0.0.1:49152 S
[ALERT] SYN Packet detected from 10.0.0.95 to 10.0.0.1 at 2024-11-25 21:54:56
Packet Data: Ether / IP / TCP 10.0.0.95:54310 > 10.0.0.1:49152 S
[ALERT] SYN Packet detected from 10.0.0.95 to 10.0.0.1 at 2024-11-25 21:54:56
Packet Data: Ether / IP / TCP 10.0.0.95:54311 > 10.0.0.1:49152 S
[ALERT] SYN Packet detected from 10.0.0.95 to 10.0.0.1 at 2024-11-25 21:54:56
Packet Data: Ether / IP / TCP 10.0.0.95:54312 > 10.0.0.1:49152 S
[ALERT] SYN Packet detected from 10.0.0.95 to 10.0.0.1 at 2024-11-25 21:54:57
Packet Data: Ether / IP / TCP 10.0.0.95:54313 > 10.0.0.1:49152 S
[ALERT] SYN Packet detected from 10.0.0.95 to 10.0.0.1 at 2024-11-25 21:54:57
Packet Data: Ether / IP / TCP 10.0.0.95:54314 > 10.0.0.1:49152 S
[ALERT] SYN Packet detected from 10.0.0.1 to 10.0.0.95 at 2024-11-25 21:54:57
Packet Data: Ether / IP / TCP 10.0.0.1:47026 > 10.0.0.95:icslap S
[ALERT] SYN Packet detected from 10.0.0.1 to 10.0.0.95 at 2024-11-25 21:54:57
Packet Data: Ether / IP / TCP 10.0.0.1:47028 > 10.0.0.95:icslap S
[ALERT] SYN Packet detected from 10.0.0.95 to 10.0.0.1 at 2024-11-25 21:54:57
Packet Data: Ether / IP / TCP 10.0.0.95:54315 > 10.0.0.1:49152 S
[ALERT] SYN Packet detected from 10.0.0.95 to 10.0.0.1 at 2024-11-25 21:54:57
Packet Data: Ether / IP / TCP 10.0.0.95:54316 > 10.0.0.1:49152 S
[ALERT] SYN Packet detected from 10.0.0.95 to 10.0.0.1 at 2024-11-25 21:54:57
Packet Data: Ether / IP / TCP 10.0.0.95:54317 > 10.0.0.1:49152 S
[ALERT] SYN Packet detected from 10.0.0.95 to 10.0.0.1 at 2024-11-25 21:54:57
Packet Data: Ether / IP / TCP 10.0.0.95:54318 > 10.0.0.1:49152 S
[ALERT] SYN Packet detected from 10.0.0.95 to 10.0.0.1 at 2024-11-25 21:54:57
Packet Data: Ether / IP / TCP 10.0.0.95:54319 > 10.0.0.1:49152 S
[ALERT] SYN Packet detected from 10.0.0.95 to 10.0.0.1 at 2024-11-25 21:54:57
Packet Data: Ether / IP / TCP 10.0.0.95:54320 > 10.0.0.1:49152 S
[ALERT] SYN Packet detected from 10.0.0.95 to 10.0.0.1 at 2024-11-25 21:54:58
Packet Data: Ether / IP / TCP 10.0.0.95:54321 > 10.0.0.1:49152 S
[ALERT] SYN Packet detected from 10.0.0.95 to 10.0.0.1 at 2024-11-25 21:54:58
Packet Data: Ether / IP / TCP 10.0.0.95:54322 > 10.0.0.1:49152 S
[ALERT] SYN Packet detected from 10.0.0.95 to 10.0.0.1 at 2024-11-25 21:54:58
Packet Data: Ether / IP / TCP 10.0.0.95:54323 > 10.0.0.1:49152 S
[ALERT] SYN Packet detected from 10.0.0.95 to 10.0.0.1 at 2024-11-25 21:54:58
Packet Data: Ether / IP / TCP 10.0.0.95:54324 > 10.0.0.1:49152 S
[ALERT] SYN Packet detected from 10.0.0.95 to 10.0.0.1 at 2024-11-25 21:54:58
Packet Data: Ether / IP / TCP 10.0.0.95:54325 > 10.0.0.1:49152 S
[ALERT] SYN Packet detected from 10.0.0.95 to 10.0.0.1 at 2024-11-25 21:54:58
Packet Data: Ether / IP / TCP 10.0.0.95:54326 > 10.0.0.1:49152 S
[ALERT] SYN Packet detected from 10.0.0.95 to 10.0.0.1 at 2024-11-25 21:54:59
Packet Data: Ether / IP / TCP 10.0.0.95:54327 > 10.0.0.1:49152 S
[ALERT] SYN Packet detected from 10.0.0.95 to 10.0.0.1 at 2024-11-25 21:54:59
Packet Data: Ether / IP / TCP 10.0.0.95:54328 > 10.0.0.1:49152 S
[ALERT] SYN Packet detected from 10.0.0.95 to 10.0.0.1 at 2024-11-25 21:54:59
Packet Data: Ether / IP / TCP 10.0.0.95:54329 > 10.0.0.1:49152 S
[ALERT] SYN Packet detected from 10.0.0.95 to 10.0.0.1 at 2024-11-25 21:54:59
Packet Data: Ether / IP / TCP 10.0.0.95:54330 > 10.0.0.1:49152 S
[ALERT] SYN Packet detected from 10.0.0.95 to 10.0.0.1 at 2024-11-25 21:54:59
Packet Data: Ether / IP / TCP 10.0.0.95:54331 > 10.0.0.1:49152 S
[ALERT] SYN Packet detected from 10.0.0.95 to 10.0.0.1 at 2024-11-25 21:54:59
Packet Data: Ether / IP / TCP 10.0.0.95:54332 > 10.0.0.1:49152 S
[ALERT] SYN Packet detected from 10.0.0.1 to 10.0.0.95 at 2024-11-25 21:54:59
Packet Data: Ether / IP / TCP 10.0.0.1:47026 > 10.0.0.95:icslap S
[ALERT] SYN Packet detected from 10.0.0.1 to 10.0.0.95 at 2024-11-25 21:54:59
Packet Data: Ether / IP / TCP 10.0.0.1:47028 > 10.0.0.95:icslap S
[ALERT] SYN Packet detected from 10.0.0.95 to 52.1.113.157 at 2024-11-25 21:55:18
Packet Data: Ether / IP / TCP 10.0.0.95:54333 > 52.1.113.157:https S
[ALERT] SYN Packet detected from 10.0.0.95 to 23.204.53.201 at 2024-11-25 21:55:56
Packet Data: Ether / IP / TCP 10.0.0.95:54334 > 23.204.53.201:http S
[ALERT] SYN Packet detected from 10.0.0.95 to 204.79.197.203 at 2024-11-25 21:55:58
Packet Data: Ether / IP / TCP 10.0.0.95:54336 > 204.79.197.203:https S
[ALERT] SYN Packet detected from 10.0.0.95 to 23.101.168.44 at 2024-11-25 21:55:58
Packet Data: Ether / IP / TCP 10.0.0.95:54337 > 23.101.168.44:https S
[ALERT] SYN Packet detected from 10.0.0.95 to 52.168.112.66 at 2024-11-25 21:56:10
Packet Data: Ether / IP / TCP 10.0.0.95:54338 > 52.168.112.66:https S
[ALERT] SYN Packet detected from 10.0.0.95 to 20.189.173.25 at 2024-11-25 21:56:10
Packet Data: Ether / IP / TCP 10.0.0.95:54339 > 20.189.173.25:https S
[ALERT] SYN Packet detected from 10.0.0.95 to 3.212.119.46 at 2024-11-25 21:56:32
Packet Data: Ether / IP / TCP 10.0.0.95:54341 > 3.212.119.46:https S
[ALERT] SYN Packet detected from 10.0.0.95 to 20.49.19.163 at 2024-11-25 21:56:39
Packet Data: Ether / IP / TCP 10.0.0.95:54342 > 20.49.19.163:https S
[ALERT] SYN Packet detected from 10.0.0.95 to 52.168.112.66 at 2024-11-25 21:56:40
Packet Data: Ether / IP / TCP 10.0.0.95:54343 > 52.168.112.66:https S
[ALERT] SYN Packet detected from 10.0.0.95 to 13.58.249.194 at 2024-11-25 21:56:52
Packet Data: Ether / IP / TCP 10.0.0.95:54344 > 13.58.249.194:https S
[ALERT] SYN Packet detected from 10.0.0.95 to 10.0.0.1 at 2024-11-25 21:57:01
Packet Data: Ether / IP / TCP 10.0.0.95:54345 > 10.0.0.1:49152 S
[ALERT] SYN Packet detected from 10.0.0.95 to 20.189.173.5 at 2024-11-25 21:57:13
Packet Data: Ether / IP / TCP 10.0.0.95:54346 > 20.189.173.5:https S
[ALERT] SYN Packet detected from 10.0.0.95 to 152.199.4.33 at 2024-11-25 21:57:28
Packet Data: Ether / IP / TCP 10.0.0.95:54348 > 152.199.4.33:https S
[ALERT] SYN Packet detected from 10.0.0.95 to 3.212.119.46 at 2024-11-25 21:57:42
Packet Data: Ether / IP / TCP 10.0.0.95:54350 > 3.212.119.46:https S
[ALERT] SYN Packet detected from 10.0.0.95 to 54.221.126.158 at 2024-11-25 21:58:06
Packet Data: Ether / IP / TCP 10.0.0.95:54351 > 54.221.126.158:https S
[ALERT] SYN Packet detected from 10.0.0.95 to 44.217.28.87 at 2024-11-25 21:58:06
Packet Data: Ether / IP / TCP 10.0.0.95:54352 > 44.217.28.87:https S
[ALERT] SYN Packet detected from 10.0.0.95 to 52.7.237.141 at 2024-11-25 21:59:07
Packet Data: Ether / IP / TCP 10.0.0.95:54354 > 52.7.237.141:https S
[ALERT] SYN Packet detected from 10.0.0.95 to 20.44.239.154 at 2024-11-25 22:00:42
Packet Data: Ether / IP / TCP 10.0.0.95:54357 > 20.44.239.154:https S
[ALERT] SYN Packet detected from 10.0.0.95 to 23.204.53.201 at 2024-11-25 22:00:46
Packet Data: Ether / IP / TCP 10.0.0.95:54362 > 23.204.53.201:http S
[ALERT] SYN Packet detected from 10.0.0.95 to 20.190.157.14 at 2024-11-25 22:00:46
Packet Data: Ether / IP / TCP 10.0.0.95:54364 > 20.190.157.14:https S
[ALERT] SYN Packet detected from 10.0.0.95 to 20.241.44.114 at 2024-11-25 22:00:50
Packet Data: Ether / IP / TCP 10.0.0.95:54365 > 20.241.44.114:https S
[ALERT] SYN Packet detected from 10.0.0.95 to 10.0.0.1 at 2024-11-25 22:00:51
Packet Data: Ether / IP / TCP 10.0.0.95:54367 > 10.0.0.1:49152 S
[ALERT] SYN Packet detected from 10.0.0.95 to 20.241.44.114 at 2024-11-25 22:00:55
Packet Data: Ether / IP / TCP 10.0.0.95:54371 > 20.241.44.114:https S
[ALERT] SYN Packet detected from 10.0.0.95 to 20.190.157.14 at 2024-11-25 22:01:00
Packet Data: Ether / IP / TCP 10.0.0.95:54376 > 20.190.157.14:https S
[ALERT] SYN Packet detected from 10.0.0.95 to 20.49.19.163 at 2024-11-25 22:01:00
Packet Data: Ether / IP / TCP 10.0.0.95:54377 > 20.49.19.163:https S
[ALERT] SYN Packet detected from 10.0.0.95 to 51.105.71.137 at 2024-11-25 22:01:01
Packet Data: Ether / IP / TCP 10.0.0.95:54378 > 51.105.71.137:https S
[ALERT] SYN Packet detected from 10.0.0.95 to 20.49.43.163 at 2024-11-25 22:01:01
Packet Data: Ether / IP / TCP 10.0.0.95:54379 > 20.49.43.163:https S
[ALERT] SYN Packet detected from 10.0.0.95 to 20.49.43.163 at 2024-11-25 22:01:02
Packet Data: Ether / IP / TCP 10.0.0.95:54380 > 20.49.43.163:https S
[ALERT] SYN Packet detected from 10.0.0.95 to 20.49.19.163 at 2024-11-25 22:01:04
Packet Data: Ether / IP / TCP 10.0.0.95:54381 > 20.49.19.163:https S
[ALERT] SYN Packet detected from 10.0.0.95 to 20.190.157.14 at 2024-11-25 22:01:15
Packet Data: Ether / IP / TCP 10.0.0.95:54384 > 20.190.157.14:https S
[ALERT] SYN Packet detected from 10.0.0.95 to 20.190.157.14 at 2024-11-25 22:01:16
Packet Data: Ether / IP / TCP 10.0.0.95:54385 > 20.190.157.14:https S
[ALERT] SYN Packet detected from 10.0.0.95 to 20.190.157.14 at 2024-11-25 22:01:16
Packet Data: Ether / IP / TCP 10.0.0.95:54386 > 20.190.157.14:https S
[ALERT] SYN Packet detected from 10.0.0.95 to 52.168.117.169 at 2024-11-25 22:01:16
Packet Data: Ether / IP / TCP 10.0.0.95:54388 > 52.168.117.169:https S
[ALERT] SYN Packet detected from 10.0.0.95 to 13.69.239.72 at 2024-11-25 22:01:31
Packet Data: Ether / IP / TCP 10.0.0.95:54389 > 13.69.239.72:https S
[ALERT] SYN Packet detected from 10.0.0.95 to 20.49.19.163 at 2024-11-25 22:01:39
Packet Data: Ether / IP / TCP 10.0.0.95:54390 > 20.49.19.163:https S
[ALERT] SYN Packet detected from 10.0.0.95 to 3.212.119.46 at 2024-11-25 22:01:40
Packet Data: Ether / IP / TCP 10.0.0.95:54391 > 3.212.119.46:https S
[ALERT] SYN Packet detected from 10.0.0.95 to 20.42.73.24 at 2024-11-25 22:01:40
Packet Data: Ether / IP / TCP 10.0.0.95:54392 > 20.42.73.24:https S
[ALERT] SYN Packet detected from 10.0.0.95 to 13.107.5.93 at 2024-11-25 22:02:16
Packet Data: Ether / IP / TCP 10.0.0.95:54394 > 13.107.5.93:https S
[ALERT] SYN Packet detected from 10.0.0.95 to 13.107.5.93 at 2024-11-25 22:02:17
Packet Data: Ether / IP / TCP 10.0.0.95:54395 > 13.107.5.93:https S
[ALERT] SYN Packet detected from 10.0.0.95 to 13.107.5.93 at 2024-11-25 22:02:20
Packet Data: Ether / IP / TCP 10.0.0.95:54396 > 13.107.5.93:https S
[ALERT] SYN Packet detected from 10.0.0.95 to 13.107.5.93 at 2024-11-25 22:02:23
Packet Data: Ether / IP / TCP 10.0.0.95:54397 > 13.107.5.93:https S
[ALERT] SYN Packet detected from 10.0.0.95 to 13.107.5.93 at 2024-11-25 22:02:24
Packet Data: Ether / IP / TCP 10.0.0.95:54398 > 13.107.5.93:https S
[ALERT] SYN Packet detected from 10.0.0.95 to 72.21.81.200 at 2024-11-25 22:02:25
Packet Data: Ether / IP / TCP 10.0.0.95:54399 > 72.21.81.200:https S
[ALERT] SYN Packet detected from 10.0.0.95 to 152.199.4.33 at 2024-11-25 22:02:30
Packet Data: Ether / IP / TCP 10.0.0.95:54400 > 152.199.4.33:https S
[ALERT] SYN Packet detected from 10.0.0.95 to 20.49.19.163 at 2024-11-25 22:02:31
Packet Data: Ether / IP / TCP 10.0.0.95:54402 > 20.49.19.163:https S
[ALERT] SYN Packet detected from 10.0.0.95 to 20.189.173.5 at 2024-11-25 22:02:32
Packet Data: Ether / IP / TCP 10.0.0.95:54404 > 20.189.173.5:https S
[ALERT] SYN Packet detected from 10.0.0.95 to 20.42.72.131 at 2024-11-25 22:02:40
Packet Data: Ether / IP / TCP 10.0.0.95:54406 > 20.42.72.131:https S
[ALERT] SYN Packet detected from 10.0.0.95 to 20.42.73.31 at 2024-11-25 22:02:42
Packet Data: Ether / IP / TCP 10.0.0.95:54408 > 20.42.73.31:https S
[ALERT] SYN Packet detected from 10.0.0.95 to 3.21.194.7 at 2024-11-25 22:02:47
Packet Data: Ether / IP / TCP 10.0.0.95:54414 > 3.21.194.7:https S
[ALERT] SYN Packet detected from 10.0.0.95 to 99.84.160.58 at 2024-11-25 22:02:47
Packet Data: Ether / IP / TCP 10.0.0.95:54415 > 99.84.160.58:https S
[ALERT] SYN Packet detected from 10.0.0.95 to 162.247.243.29 at 2024-11-25 22:02:48
Packet Data: Ether / IP / TCP 10.0.0.95:54416 > 162.247.243.29:https S
[ALERT] SYN Packet detected from 10.0.0.95 to 162.247.243.29 at 2024-11-25 22:02:48
Packet Data: Ether / IP / TCP 10.0.0.95:54417 > 162.247.243.29:https S
[ALERT] SYN Packet detected from 10.0.0.95 to 3.212.119.46 at 2024-11-25 22:02:49
Packet Data: Ether / IP / TCP 10.0.0.95:54418 > 3.212.119.46:https S
[ALERT] SYN Packet detected from 10.0.0.95 to 162.247.243.29 at 2024-11-25 22:02:51
Packet Data: Ether / IP / TCP 10.0.0.95:54420 > 162.247.243.29:https S
[ALERT] SYN Packet detected from 10.0.0.95 to 162.247.243.29 at 2024-11-25 22:02:51
Packet Data: Ether / IP / TCP 10.0.0.95:54421 > 162.247.243.29:https S
[ALERT] SYN Packet detected from 10.0.0.95 to 162.247.243.29 at 2024-11-25 22:02:51
Packet Data: Ether / IP / TCP 10.0.0.95:54422 > 162.247.243.29:https S
[ALERT] SYN Packet detected from 10.0.0.95 to 52.7.181.214 at 2024-11-25 22:02:57
Packet Data: Ether / IP / TCP 10.0.0.95:54424 > 52.7.181.214:https S
[ALERT] SYN Packet detected from 10.0.0.95 to 108.156.107.74 at 2024-11-25 22:02:57
Packet Data: Ether / IP / TCP 10.0.0.95:54425 > 108.156.107.74:https S
[ALERT] SYN Packet detected from 10.0.0.95 to 20.69.137.228 at 2024-11-25 22:03:35
Packet Data: Ether / IP / TCP 10.0.0.95:54427 > 20.69.137.228:https S
[ALERT] SYN Packet detected from 10.0.0.95 to 20.190.157.14 at 2024-11-25 22:03:36
Packet Data: Ether / IP / TCP 10.0.0.95:54428 > 20.190.157.14:https S
[ALERT] SYN Packet detected from 10.0.0.95 to 20.190.157.14 at 2024-11-25 22:03:44
Packet Data: Ether / IP / TCP 10.0.0.95:54430 > 20.190.157.14:https S
[ALERT] SYN Packet detected from 10.0.0.95 to 35.170.7.69 at 2024-11-25 22:03:50
Packet Data: Ether / IP / TCP 10.0.0.95:54431 > 35.170.7.69:https S
[ALERT] SYN Packet detected from 10.0.0.95 to 52.1.20.170 at 2024-11-25 22:04:01
Packet Data: Ether / IP / TCP 10.0.0.95:54433 > 52.1.20.170:https S
[ALERT] SYN Packet detected from 10.0.0.95 to 52.84.52.102 at 2024-11-25 22:04:01
Packet Data: Ether / IP / TCP 10.0.0.95:54434 > 52.84.52.102:https S
[ALERT] SYN Packet detected from 10.0.0.95 to 54.87.94.142 at 2024-11-25 22:04:01
Packet Data: Ether / IP / TCP 10.0.0.95:54435 > 54.87.94.142:https S
[ALERT] SYN Packet detected from 10.0.0.95 to 52.72.179.104 at 2024-11-25 22:04:02
Packet Data: Ether / IP / TCP 10.0.0.95:54436 > 52.72.179.104:https S
[ALERT] SYN Packet detected from 10.0.0.95 to 52.182.143.211 at 2024-11-25 22:04:28
Packet Data: Ether / IP / TCP 10.0.0.95:54439 > 52.182.143.211:https S
[ALERT] SYN Packet detected from 10.0.0.95 to 20.189.173.11 at 2024-11-25 22:04:32
Packet Data: Ether / IP / TCP 10.0.0.95:54440 > 20.189.173.11:https S
[ALERT] SYN Packet detected from 10.0.0.95 to 35.170.7.69 at 2024-11-25 22:05:00
Packet Data: Ether / IP / TCP 10.0.0.95:54441 > 35.170.7.69:https S
[ALERT] SYN Packet detected from 10.0.0.95 to 40.70.76.27 at 2024-11-25 22:05:39
Packet Data: Ether / IP / TCP 10.0.0.95:54443 > 40.70.76.27:https S
[ALERT] SYN Packet detected from 10.0.0.95 to 40.70.76.27 at 2024-11-25 22:05:39
Packet Data: Ether / IP / TCP 10.0.0.95:54444 > 40.70.76.27:https S
[ALERT] SYN Packet detected from 10.0.0.95 to 20.69.137.228 at 2024-11-25 22:06:07
Packet Data: Ether / IP / TCP 10.0.0.95:54445 > 20.69.137.228:https S
[ALERT] SYN Packet detected from 10.0.0.95 to 20.189.173.10 at 2024-11-25 22:06:12
Packet Data: Ether / IP / TCP 10.0.0.95:54446 > 20.189.173.10:https S
[ALERT] SYN Packet detected from 10.0.0.95 to 20.189.173.27 at 2024-11-25 22:06:12
Packet Data: Ether / IP / TCP 10.0.0.95:54447 > 20.189.173.27:https S
